_id,spending_behavior,processing_timestamp,applicant_info.full_name,applicant_info.email,applicant_info.ssn,applicant_info.ip_address,applicant_info.gender,applicant_info.date_of_birth,applicant_info.zip_code,financials.annual_income,financials.credit_history_months,financials.debt_to_income,financials.savings_balance,decision.loan_approved,decision.rejection_reason,loan_purpose,decision.interest_rate,decision.approved_amount,financials.annual_salary,notes,source_row,applicant_info.gender_clean,applicant_info.date_of_birth_clean,financials.annual_income_clean,financials.credit_history_months_clean,financials.debt_to_income_clean,financials.savings_balance_clean,flag_duplicate_id,flag_invalid_email,flag_non_iso_dob_input,flag_negative_credit_history,flag_dti_gt_1,flag_negative_savings
app_200,"[{'category': 'Shopping', 'amount': 480}, {'category': 'Rent', 'amount': 790}, {'category': 'Alcohol', 'amount': 247}]",2024-01-15T00:00:00Z,Jerry Smith,jerry.smith17@hotmail.com,596-64-4340,192.168.48.155,Male,2001-03-09,10036,73000,23,0.2,31212,False,algorithm_risk_score,,,,,,0,Male,2001-03-09,73000.0,23,0.2,31212,False,False,False,False,False,False
app_037,"[{'category': 'Rent', 'amount': 608}, {'category': 'Dining', 'amount': 96}, {'category': 'Healthcare', 'amount': 243}]",,Brandon Walker,brandon.walker2@yahoo.com,425-69-4784,10.1.102.112,M,1992-03-31,10032,78000,51,0.18,17915,False,algorithm_risk_score,,,,,,1,Male,1992-03-31,78000.0,51,0.18,17915,False,False,False,False,False,False
app_215,"[{'category': 'Rent', 'amount': 109}]",,Scott Moore,scott.moore94@mail.com,370-78-5178,10.240.193.250,Male,1989-10-24,10075,61000,41,0.21,37909,True,,vacation,3.7,59000.0,,,2,Male,1989-10-24,61000.0,41,0.21,37909,False,False,False,False,False,False
app_024,"[{'category': 'Fitness', 'amount': 575}]",,Thomas Lee,thomas.lee6@protonmail.com,194-35-1833,192.168.175.67,Male,1983-04-25,10077,103000,70,0.35,0,True,,,4.3,34000.0,,,3,Male,1983-04-25,103000.0,70,0.35,0,False,False,False,False,False,False
app_184,"[{'category': 'Entertainment', 'amount': 463}]",2024-01-15T00:00:00Z,Brian Rodriguez,brian.rodriguez86@aol.com,480-41-2475,172.29.125.105,M,1999-05-21,10080,57000,14,0.23,31763,False,algorithm_risk_score,,,,,,4,Male,1999-05-21,57000.0,14,0.23,31763,False,False,False,False,False,False
app_275,"[{'category': 'Entertainment', 'amount': 571}]",,Maria Miller,maria.miller67@outlook.com,417-25-4912,172.25.58.70,F,14/02/1982,10019,110000,33,0.05,49933,False,algorithm_risk_score,,,,,,5,Female,1982-02-14,110000.0,33,0.05,49933,False,False,True,False,False,False
app_099,"[{'category': 'Dining', 'amount': 458}]",,Nicholas King,nicholas.king46@outlook.com,613-23-2503,10.62.62.45,Male,28/01/1990,10022,55000,61,0.17,30159,True,,,5.6,27000.0,,,6,Male,1990-01-28,55000.0,61,0.17,30159,False,False,True,False,False,False
app_246,"[{'category': 'Healthcare', 'amount': 478}]",,Susan Rivera,susan.rivera74@gmail.com,176-97-1864,192.168.158.59,F,1991-10-11,90223,82000,31,0.29,21809,True,,auto,2.8,38000.0,,,7,Female,1991-10-11,82000.0,31,0.29,21809,False,False,False,False,False,False
app_042,"[{'category': 'Insurance', 'amount': 153}, {'category': 'Dining', 'amount': 468}]",,Joseph Lopez,joseph.lopez1@gmail.com,652-70-5530,192.168.91.142,Male,1990-05-04,10044,69000,43,0.41,15974,False,algorithm_risk_score,,,,,,8,Male,1990-05-04,69000.0,43,0.41,15974,True,False,False,False,False,False
app_348,"[{'category': 'Fitness', 'amount': 199}, {'category': 'Travel', 'amount': 851}]",,Michael Mitchell,michael.mitchell42@hotmail.com,100-94-8400,172.28.12.121,Male,1989-10-10,10080,55000,5,0.41,13794,False,insufficient_credit_history,,,,,,9,Male,1989-10-10,55000.0,5,0.41,13794,False,False,False,False,False,False
app_309,"[{'category': 'Rent', 'amount': 626}, {'category': 'Transportation', 'amount': 688}]",,Patricia Carter,patricia.carter75@gmail.com,392-82-4407,192.168.231.120,Female,1970-10-01,90250,63000,99,0.37,21769,True,,,5.1,72000.0,,,10,Female,1970-10-01,63000.0,99,0.37,21769,False,False,False,False,False,False
app_320,"[{'category': 'Travel', 'amount': 403}, {'category': 'Utilities', 'amount': 706}]",,Jason Brown,jason.brown65@icloud.com,222-48-1592,192.168.52.13,Male,01/12/1978,90286,168000,58,0.35,13088,True,,,5.9,71000.0,,,11,Male,1978-12-01,168000.0,58,0.35,13088,False,False,True,False,False,False
app_007,"[{'category': 'Transportation', 'amount': 290}, {'category': 'Healthcare', 'amount': 416}]",,Emma Clark,emma.clark14@protonmail.com,191-40-8079,192.168.11.34,Female,1989-06-13,90284,92000,77,0.08,21353,True,,,5.2,27000.0,,,12,Female,1989-06-13,92000.0,77,0.08,21353,False,False,False,False,False,False
app_439,"[{'category': 'Shopping', 'amount': 685}, {'category': 'Fitness', 'amount': 97}, {'category': 'Dining', 'amount': 838}]",,Benjamin Jackson,benjamin.jackson34@gmail.com,807-60-7784,192.168.98.253,Male,1976-04-19,10019,87000,72,0.12,50675,True,,,4.2,61000.0,,,13,Male,1976-04-19,87000.0,72,0.12,50675,False,False,False,False,False,False
app_307,"[{'category': 'Shopping', 'amount': 482}]",,Joseph Lee,joseph.lee69@aol.com,178-35-6543,10.189.246.72,M,1990/07/26,10097,53000,83,0.1,17420,True,,,6.1,57000.0,,,14,Male,1990-07-26,53000.0,83,0.1,17420,False,False,True,False,False,False
app_064,"[{'category': 'Fitness', 'amount': 409}, {'category': 'Shopping', 'amount': 433}]",,Paul Martin,paul.martin91@yahoo.com,500-65-1608,192.168.73.18,Male,1992-06-22,10009,81000,64,0.37,40674,False,algorithm_risk_score,,,,,,15,Male,1992-06-22,81000.0,64,0.37,40674,False,False,False,False,False,False
app_101,"[{'category': 'Groceries', 'amount': 527}, {'category': 'Entertainment', 'amount': 464}]",,Sandra Smith,sandra.smith99@icloud.com,937-72-8731,172.30.237.98,Female,1997-03-23,90255,55000,0,0.3,15364,False,algorithm_risk_score,,,,,,16,Female,1997-03-23,55000.0,0,0.3,15364,False,False,False,False,False,False
app_133,"[{'category': 'Insurance', 'amount': 319}, {'category': 'Dining', 'amount': 407}]",,Frank Harris,frank.harris11@outlook.com,507-24-3732,172.25.65.254,Male,1989-10-07,10022,70000,72,0.16,33883,False,algorithm_risk_score,,,,,,17,Male,1989-10-07,70000.0,72,0.16,33883,False,False,False,False,False,False
app_214,"[{'category': 'Utilities', 'amount': 786}]",,Christine Miller,christine.miller65@mail.com,929-57-7649,172.17.208.126,Female,1962-08-26,90277,116000,84,0.31,41962,True,,debt_consolidation,4.1,57000.0,,,18,Female,1962-08-26,116000.0,84,0.31,41962,False,False,False,False,False,False
app_078,"[{'category': 'Transportation', 'amount': 294}]",,Rebecca Wilson,rebecca.wilson4@gmail.com,854-84-6365,172.30.31.154,Female,1997-02-25,90299,47000,19,0.26,14054,False,insufficient_credit_history,,,,,,19,Female,1997-02-25,47000.0,19,0.26,14054,False,False,False,False,False,False
app_317,"[{'category': 'Shopping', 'amount': 771}]",,Stephen Mitchell,stephen.mitchell26@yahoo.com,805-56-9241,172.16.60.139,Male,1981-10-27,10057,45000,105,0.22,19039,True,,,4.9,80000.0,,,20,Male,1981-10-27,45000.0,105,0.22,19039,False,False,False,False,False,False
app_173,"[{'category': 'Utilities', 'amount': 803}, {'category': 'Education', 'amount': 734}]",2024-01-15T00:00:00Z,Sarah Hall,sarah.hall95@hotmail.com,131-14-4051,10.168.245.226,Female,18/07/1979,90277,115000,60,0.05,62581,False,algorithm_risk_score,,,,,,21,Female,1979-07-18,115000.0,60,0.05,62581,False,False,True,False,False,False
app_352,"[{'category': 'Transportation', 'amount': 227}, {'category': 'Healthcare', 'amount': 514}]",,Deborah Miller,deborah.miller59@aol.com,514-30-3461,10.149.249.118,F,1961-11-04,90209,104000,110,0.32,25826,True,,,4.4,58000.0,,,22,Female,1961-11-04,104000.0,110,0.32,25826,False,False,False,False,False,False
app_289,"[{'category': 'Shopping', 'amount': 361}]",,Alexander Thompson,alexander.thompson21@mail.com,161-62-3645,10.115.225.196,M,20/04/1979,10080,77000,93,0.42,33650,True,,,4.1,29000.0,,,23,Male,1979-04-20,77000.0,93,0.42,33650,False,False,True,False,False,False
app_458,"[{'category': 'Groceries', 'amount': 424}, {'category': 'Alcohol', 'amount': 247}]",,Frank Rivera,frank.rivera78@gmail.com,493-26-1934,192.168.143.14,Male,1978-02-16,10006,90000,45,0.37,28672,True,,,4.3,45000.0,,,24,Male,1978-02-16,90000.0,45,0.37,28672,False,False,False,False,False,False
app_080,"[{'category': 'Utilities', 'amount': 821}, {'category': 'Dining', 'amount': 314}]",,James Torres,james.torres4@yahoo.com,951-51-4647,10.222.104.77,M,1989-08-01,10075,111000,58,0.39,18138,True,,,3.1,37000.0,,,25,Male,1989-08-01,111000.0,58,0.39,18138,False,False,False,False,False,False
app_075,"[{'category': 'Shopping', 'amount': 121}, {'category': 'Transportation', 'amount': 59}, {'category': 'Entertainment', 'amount': 882}]",,Margaret Williams,,,,,,,61000,29,0.15,25894,True,,,5.1,22000.0,,,26,Unknown,,61000.0,29,0.15,25894,False,False,False,False,False,False
app_212,"[{'category': 'Rent', 'amount': 81}]",,Amy Flores,amy.flores63@outlook.com,654-72-8456,172.17.7.50,Female,1997-12-09,90231,50000,25,0.2,20787,False,algorithm_risk_score,personal,,,,,27,Female,1997-12-09,50000.0,25,0.2,20787,False,False,False,False,False,False
app_369,"[{'category': 'Dining', 'amount': 233}, {'category': 'Education', 'amount': 700}]",,Patricia Nelson,patricia.nelson33@protonmail.com,557-16-4712,172.24.111.38,Female,1985-01-03,90259,102000,35,0.17,33980,False,algorithm_risk_score,,,,,,28,Female,1985-01-03,102000.0,35,0.17,33980,False,False,False,False,False,False
app_452,"[{'category': 'Groceries', 'amount': 626}, {'category': 'Rent', 'amount': 377}, {'category': 'Utilities', 'amount': 105}]",,Nancy Young,nancy.young58@protonmail.com,645-69-5977,192.168.219.132,F,1994-03-25,90221,66000,67,0.07,24654,False,algorithm_risk_score,,,,,,29,Female,1994-03-25,66000.0,67,0.07,24654,False,False,False,False,False,False
app_127,"[{'category': 'Entertainment', 'amount': 581}, {'category': 'Dining', 'amount': 739}, {'category': 'Utilities', 'amount': 379}]",,Brandon Taylor,brandon.taylor17@yahoo.com,708-16-1511,172.22.250.112,Male,1968-12-30,90261,73000,78,0.15,28164,True,,,5.9,53000.0,,,30,Male,1968-12-30,73000.0,78,0.15,28164,False,False,False,False,False,False
app_167,"[{'category': 'Rent', 'amount': 465}, {'category': 'Utilities', 'amount': 641}]",2024-01-15T00:00:00Z,Emma Williams,emma.williams6@icloud.com,406-96-8493,172.31.200.173,F,1983-05-10,90214,105000,32,0.17,55374,False,algorithm_risk_score,,,,,,31,Female,1983-05-10,105000.0,32,0.17,55374,False,False,False,False,False,False
app_274,"[{'category': 'Utilities', 'amount': 452}, {'category': 'Insurance', 'amount': 277}]",,Samantha Williams,samantha.williams57@icloud.com,437-17-2802,10.182.73.70,Female,1986/11/20,90235,89000,51,0.39,27953,True,,,5.6,65000.0,,,32,Female,1986-11-20,89000.0,51,0.39,27953,False,False,True,False,False,False
app_422,"[{'category': 'Rent', 'amount': 322}]",,Kathleen Flores,kathleen.flores42@yahoo.com,455-19-2179,192.168.210.173,Female,1981-08-17,90284,108000,80,0.37,30248,False,algorithm_risk_score,,,,,,33,Female,1981-08-17,108000.0,80,0.37,30248,False,False,False,False,False,False
app_280,"[{'category': 'Utilities', 'amount': 275}]",,Benjamin Thomas,benjamin.thomas34@icloud.com,235-66-1824,172.17.156.231,Male,1987-02-06,10046,57000,13,0.24,14728,False,insufficient_credit_history,,,,,,34,Male,1987-02-06,57000.0,13,0.24,14728,False,False,False,False,False,False
app_276,"[{'category': 'Groceries', 'amount': 248}, {'category': 'Healthcare', 'amount': 592}]",,Sarah Harris,sarah.harris19@icloud.com,965-43-3270,192.168.198.87,F,1995/05/07,90260,30000,0,0.13,3388,False,algorithm_risk_score,,,,,,35,Female,1995-07-05,30000.0,0,0.13,3388,False,False,True,False,False,False
app_386,"[{'category': 'Rent', 'amount': 350}]",,Angela Carter,angela.carter72@gmail.com,961-42-2857,172.21.133.119,F,03/20/1968,90283,84000,96,0.35,41312,True,,,4.7,66000.0,,,36,Female,1968-03-20,84000.0,96,0.35,41312,False,False,True,False,False,False
app_178,"[{'category': 'Rent', 'amount': 189}, {'category': 'Fitness', 'amount': 570}]",2024-01-15T00:00:00Z,Brandon Harris,brandon.harris4@outlook.com,262-63-6057,192.168.200.5,Male,20/07/1997,10027,52000,44,0.13,20921,True,,,3.8,44000.0,,,37,Male,1997-07-20,52000.0,44,0.13,20921,False,False,True,False,False,False
app_441,"[{'category': 'Fitness', 'amount': 894}]",,Katherine King,katherine.king17@outlook.com,568-34-9570,192.168.25.187,Female,1986-12-05,90268,110000,20,0.12,23593,True,,,2.6,74000.0,,,38,Female,1986-12-05,110000.0,20,0.12,23593,False,False,False,False,False,False
app_285,"[{'category': 'Healthcare', 'amount': 128}, {'category': 'Fitness', 'amount': 741}]",,Elizabeth Garcia,elizabeth.garcia70@mail.com,105-34-6367,192.168.188.222,Female,1987/06/28,90226,75000,16,0.17,13622,True,,,2.5,48000.0,,,39,Female,1987-06-28,75000.0,16,0.17,13622,False,False,True,False,False,False
app_232,"[{'category': 'Transportation', 'amount': 53}, {'category': 'Entertainment', 'amount': 185}, {'category': 'Travel', 'amount': 588}]",,Susan Williams,susan.williams56@protonmail.com,990-44-6079,192.168.82.109,Female,1985-03-04,90218,129000,60,0.1,31187,True,,personal,2.8,48000.0,,,40,Female,1985-03-04,129000.0,60,0.1,31187,False,False,False,False,False,False
app_420,"[{'category': 'Utilities', 'amount': 65}]",,Betty Allen,betty.allen48@gmail.com,543-66-7870,172.24.54.162,Female,1988/04/06,10087,81000,23,0.14,19007,True,,,3.4,66000.0,,,41,Female,1988-06-04,81000.0,23,0.14,19007,False,False,True,False,False,False
app_130,"[{'category': 'Healthcare', 'amount': 804}, {'category': 'Fitness', 'amount': 671}, {'category': 'Rent', 'amount': 598}]",,Jennifer Wright,jennifer.wright10@mail.com,286-43-9771,172.27.3.208,Female,03/10/1981,90252,135000,62,0.09,30902,False,algorithm_risk_score,,,,,,42,Female,1981-10-03,135000.0,62,0.09,30902,False,False,True,False,False,False
app_169,"[{'category': 'Insurance', 'amount': 623}]",2024-01-15T00:00:00Z,Brian Brown,brian.brown29@icloud.com,566-85-7180,10.10.233.92,Male,1986-12-06,10014,85000,45,0.11,61833,True,,,4.4,28000.0,,,43,Male,1986-12-06,85000.0,45,0.11,61833,False,False,False,False,False,False
app_108,"[{'category': 'Transportation', 'amount': 383}]",,Timothy Thomas,timothy.thomas35@yahoo.com,829-65-3490,10.226.135.76,Male,14/06/1975,10057,93000,62,0.42,29257,True,,,4.2,44000.0,,,44,Male,1975-06-14,93000.0,62,0.42,29257,False,False,True,False,False,False
app_497,"[{'category': 'Groceries', 'amount': 423}]",,Patrick Wilson,patrick.wilson77@hotmail.com,655-58-3025,10.131.43.18,Male,04/20/1994,90233,48000,4,0.1,21540,False,algorithm_risk_score,,,,,,45,Male,1994-04-20,48000.0,4,0.1,21540,False,False,True,False,False,False
app_174,"[{'category': 'Fitness', 'amount': 98}]",2024-01-15T00:00:00Z,Katherine Baker,katherine.baker50@outlook.com,405-23-3195,192.168.75.133,Female,1990-01-15,90237,98000,31,0.34,34731,True,,,2.7,33000.0,,,46,Female,1990-01-15,98000.0,31,0.34,34731,False,False,False,False,False,False
app_010,"[{'category': 'Utilities', 'amount': 866}]",,Barbara Rodriguez,barbara.rodriguez33@icloud.com,624-58-7406,10.100.68.10,Female,1996-09-07,90250,44000,62,0.25,6824,False,algorithm_risk_score,,,,,,47,Female,1996-09-07,44000.0,62,0.25,6824,False,False,False,False,False,False
app_486,"[{'category': 'Transportation', 'amount': 777}]",,Nicholas Garcia,nicholas.garcia36@gmail.com,109-41-3092,192.168.244.27,Male,1963-09-15,10040,79000,95,0.09,35264,True,,,2.9,64000.0,,,48,Male,1963-09-15,79000.0,95,0.09,35264,False,False,False,False,False,False
app_367,"[{'category': 'Shopping', 'amount': 558}, {'category': 'Insurance', 'amount': 359}]",,Heather Davis,heather.davis33@icloud.com,618-61-5297,192.168.21.66,Female,04/08/1979,90212,97000,64,0.33,36196,True,,,2.7,76000.0,,,49,Female,1979-08-04,97000.0,64,0.33,36196,False,False,True,False,False,False
app_360,"[{'category': 'Utilities', 'amount': 167}, {'category': 'Transportation', 'amount': 52}, {'category': 'Entertainment', 'amount': 363}]",,Eric Brown,eric.brown89@hotmail.com,659-91-9371,172.24.47.60,Male,1971-12-16,30007,107000,104,0.13,31281,True,,,2.8,53000.0,,,50,Male,1971-12-16,107000.0,104,0.13,31281,False,False,False,False,False,False
app_115,"[{'category': 'Transportation', 'amount': 239}]",,Maria Mitchell,maria.mitchell17@yahoo.com,799-16-1536,10.101.190.145,Female,1977-02-09,90294,123000,52,0.07,82257,True,,,3.6,23000.0,,,51,Female,1977-02-09,123000.0,52,0.07,82257,False,False,False,False,False,False
app_084,"[{'category': 'Shopping', 'amount': 217}]",,Pamela Scott,pamela.scott14@icloud.com,478-77-8200,10.162.27.170,Female,1986-03-24,90279,160000,54,0.4,78286,True,,,4.0,50000.0,,,52,Female,1986-03-24,160000.0,54,0.4,78286,False,False,False,False,False,False
app_491,"[{'category': 'Healthcare', 'amount': 792}]",,Mary Harris,mary.harris76@protonmail.com,945-13-9714,10.78.4.251,Female,1974-01-17,10048,79000,100,0.1,30078,False,algorithm_risk_score,,,,,,53,Female,1974-01-17,79000.0,100,0.1,30078,False,False,False,False,False,False
app_065,"[{'category': 'Rent', 'amount': 841}, {'category': 'Healthcare', 'amount': 433}, {'category': 'Insurance', 'amount': 836}]",,Amy Sanchez,amy.sanchez67@mail.com,684-77-5305,10.60.248.190,F,1992-10-08,10070,109000,41,0.37,30645,False,algorithm_risk_score,,,,,,54,Female,1992-10-08,109000.0,41,0.37,30645,False,False,False,False,False,False
app_148,"[{'category': 'Shopping', 'amount': 887}, {'category': 'Insurance', 'amount': 719}]",2024-01-15T00:00:00Z,Shirley Davis,shirley.davis62@icloud.com,384-17-7019,10.121.226.226,Female,1982-08-11,90261,122000,72,0.37,35207,True,,,3.3,25000.0,,,55,Female,1982-08-11,122000.0,72,0.37,35207,False,False,False,False,False,False
app_028,"[{'category': 'Fitness', 'amount': 145}]",,Brenda Robinson,brenda.robinson48@mail.com,636-75-6279,172.21.129.236,Female,1985-09-06,10003,90000,60,0.2,38832,False,algorithm_risk_score,,,,,,56,Female,1985-09-06,90000.0,60,0.2,38832,False,False,False,False,False,False
app_272,"[{'category': 'Dining', 'amount': 372}]",,Rebecca Rivera,rebecca.rivera38@outlook.com,160-39-1506,10.75.157.206,Female,1982-03-02,90227,79000,70,0.41,34365,False,algorithm_risk_score,,,,,,57,Female,1982-03-02,79000.0,70,0.41,34365,False,False,False,False,False,False
app_263,"[{'category': 'Entertainment', 'amount': 372}]",,Jeffrey Green,jeffrey.green8@hotmail.com,183-73-3729,172.26.114.52,Male,1983-12-16,10055,153000,64,0.07,39627,True,,,5.0,68000.0,,,58,Male,1983-12-16,153000.0,64,0.07,39627,False,False,False,False,False,False
app_160,"[{'category': 'Entertainment', 'amount': 883}, {'category': 'Fitness', 'amount': 128}]",2024-01-15T00:00:00Z,George Thompson,george.thompson36@aol.com,904-48-6710,192.168.48.92,Male,29/12/1982,10056,80000,18,0.18,58748,True,,,2.8,31000.0,,,59,Male,1982-12-29,80000.0,18,0.18,58748,False,False,True,False,False,False
app_228,"[{'category': 'Education', 'amount': 675}, {'category': 'Insurance', 'amount': 321}]",,Emily Walker,emily.walker42@outlook.com,175-63-6572,192.168.253.184,Female,14/12/1987,90280,70000,58,0.42,25883,True,,vacation,3.5,35000.0,,,60,Female,1987-12-14,70000.0,58,0.42,25883,False,False,True,False,False,False
app_076,"[{'category': 'Utilities', 'amount': 801}]",,Sarah Taylor,sarah.taylor74@icloud.com,773-71-1401,172.27.159.52,Female,1990-12-28,90285,66000,35,0.43,13607,False,insufficient_credit_history,,,,,,61,Female,1990-12-28,66000.0,35,0.43,13607,False,False,False,False,False,False
app_410,"[{'category': 'Dining', 'amount': 400}, {'category': 'Alcohol', 'amount': 638}]",,Edward Mitchell,edward.mitchell78@hotmail.com,330-61-3858,192.168.30.200,Male,1995-06-21,10051,66000,6,0.24,30498,True,,,4.9,41000.0,,,62,Male,1995-06-21,66000.0,6,0.24,30498,False,False,False,False,False,False
app_208,"[{'category': 'Dining', 'amount': 114}, {'category': 'Fitness', 'amount': 795}]",,James Martin,james.martin69@hotmail.com,155-19-6776,172.17.130.224,Male,1966-10-28,10061,97000,92,0.34,21594,True,,education,2.8,26000.0,,,63,Male,1966-10-28,97000.0,92,0.34,21594,False,False,False,False,False,False
app_279,"[{'category': 'Transportation', 'amount': 725}, {'category': 'Fitness', 'amount': 722}, {'category': 'Shopping', 'amount': 260}]",,Joseph Scott,joseph.scott2@yahoo.com,448-37-9481,172.18.113.220,M,1982-12-11,30012,75000,76,0.39,4974,True,,,5.4,15000.0,,,64,Male,1982-12-11,75000.0,76,0.39,4974,False,False,False,False,False,False
app_241,"[{'category': 'Utilities', 'amount': 485}, {'category': 'Groceries', 'amount': 503}, {'category': 'Shopping', 'amount': 89}]",,Helen Anderson,helen.anderson61@mail.com,852-81-4532,192.168.33.162,Female,1964-07-10,90230,96000,103,0.44,31709,True,,personal,5.8,18000.0,,,65,Female,1964-07-10,96000.0,103,0.44,31709,False,False,False,False,False,False
app_054,"[{'category': 'Utilities', 'amount': 566}]",,Jack Martin,jack.martin17@protonmail.com,944-51-9855,192.168.146.66,Male,1995-12-10,10043,86000,16,0.26,28260,True,,,6.3,61000.0,,,66,Male,1995-12-10,86000.0,16,0.26,28260,False,False,False,False,False,False
app_195,"[{'category': 'Rent', 'amount': 227}, {'category': 'Travel', 'amount': 554}, {'category': 'Insurance', 'amount': 190}, {'category': 'Adult Entertainment', 'amount': 579}]",2024-01-15T00:00:00Z,Mark Campbell,mark.campbell36@aol.com,730-25-4224,192.168.3.184,Male,1992-03-26,10005,61000,0,0.29,19373,True,,,5.1,77000.0,,,67,Male,1992-03-26,61000.0,0,0.29,19373,False,False,False,False,False,False
app_015,"[{'category': 'Healthcare', 'amount': 101}, {'category': 'Fitness', 'amount': 698}, {'category': 'Education', 'amount': 470}]",,Michael Lopez,michael.lopez67@yahoo.com,752-48-9134,192.168.244.94,Male,1985-11-09,10061,118000,96,0.4,76692,False,algorithm_risk_score,,,,,,68,Male,1985-11-09,118000.0,96,0.4,76692,False,False,False,False,False,False
app_039,"[{'category': 'Utilities', 'amount': 513}]",,Robert Anderson,robert.anderson1@hotmail.com,892-10-2689,192.168.126.225,Male,30/09/1978,90249,137000,73,0.29,62951,False,algorithm_risk_score,,,,,,69,Male,1978-09-30,137000.0,73,0.29,62951,False,False,True,False,False,False
app_492,"[{'category': 'Transportation', 'amount': 576}, {'category': 'Gambling', 'amount': 339}]",,Cynthia Garcia,cynthia.garcia42@mail.com,809-99-1251,172.25.153.215,Female,1994/03/03,90225,46000,0,0.09,9578,False,algorithm_risk_score,,,,,,70,Female,1994-03-03,46000.0,0,0.09,9578,False,False,True,False,False,False
app_093,"[{'category': 'Education', 'amount': 857}, {'category': 'Fitness', 'amount': 338}]",,Margaret Allen,margaret.allen89@yahoo.com,343-37-9988,172.20.198.144,F,1983-01-01,90230,137000,36,0.08,16139,True,,,6.1,59000.0,,,71,Female,1983-01-01,137000.0,36,0.08,16139,False,False,False,False,False,False
app_356,"[{'category': 'Insurance', 'amount': 171}]",,Gary Davis,gary.davis57@gmail.com,291-94-4709,10.171.154.188,Male,1987-01-17,10058,69000,67,0.4,28596,True,,,5.9,37000.0,,,72,Male,1987-01-17,69000.0,67,0.4,28596,False,False,False,False,False,False
app_164,"[{'category': 'Utilities', 'amount': 218}, {'category': 'Travel', 'amount': 798}, {'category': 'Transportation', 'amount': 430}]",2024-01-15T00:00:00Z,Brian Brown,brian.brown61@yahoo.com,586-29-4288,192.168.240.12,Male,1978-10-04,10004,101000,117,0.14,34221,True,,,4.1,62000.0,,,73,Male,1978-10-04,101000.0,117,0.14,34221,False,False,False,False,False,False
app_372,"[{'category': 'Utilities', 'amount': 582}]",,Kathleen Mitchell,kathleen.mitchell10@outlook.com,381-49-1110,192.168.116.86,Female,11/03/1967,90229,77000,115,0.22,22843,False,algorithm_risk_score,,,,,,74,Female,1967-03-11,77000.0,115,0.22,22843,False,False,True,False,False,False
app_460,"[{'category': 'Utilities', 'amount': 438}]",,Helen Ramirez,helen.ramirez17@yahoo.com,993-57-7662,10.10.20.83,Female,1988-05-31,90266,85000,19,0.41,28777,False,insufficient_credit_history,,,,,,75,Female,1988-05-31,85000.0,19,0.41,28777,False,False,False,False,False,False
app_436,"[{'category': 'Insurance', 'amount': 339}]",,Amanda Torres,amanda.torres59@gmail.com,135-51-1195,172.18.137.22,F,1998-06-02,90217,,35,0.13,10311,True,,,3.9,63000.0,45000.0,,76,Female,1998-06-02,,35,0.13,10311,False,False,False,False,False,False
app_392,"[{'category': 'Insurance', 'amount': 68}]",,Emma Johnson,emma.johnson73@yahoo.com,518-98-9708,192.168.52.95,Female,28/11/1998,90217,56000,0,0.16,25551,True,,,4.5,39000.0,,,77,Female,1998-11-28,56000.0,0,0.16,25551,False,False,True,False,False,False
app_264,"[{'category': 'Shopping', 'amount': 802}]",,Stephen Wright,stephen.wright37@yahoo.com,988-31-5993,172.20.59.38,Male,1996/04/07,10063,50000,19,0.23,17902,True,,,4.3,39000.0,,,78,Male,1996-07-04,50000.0,19,0.23,17902,False,False,True,False,False,False
app_032,"[{'category': 'Utilities', 'amount': 483}, {'category': 'Shopping', 'amount': 767}, {'category': 'Rent', 'amount': 694}, {'category': 'Adult Entertainment', 'amount': 497}]",,Andrew Martinez,andrew.martinez39@outlook.com,788-38-3158,172.26.119.18,Male,1982-09-29,30019,124000,72,0.07,24282,True,,,5.5,75000.0,,,79,Male,1982-09-29,124000.0,72,0.07,24282,False,False,False,False,False,False
app_483,"[{'category': 'Entertainment', 'amount': 474}]",,Michael Sanchez,michael.sanchez85@aol.com,871-12-1159,192.168.5.114,M,1975-09-11,10047,99000,44,0.07,27423,True,,,6.5,80000.0,,,80,Male,1975-09-11,99000.0,44,0.07,27423,False,False,False,False,False,False
app_008,"[{'category': 'Utilities', 'amount': 881}]",,Karen Martin,karen.martin3@outlook.com,351-97-8739,10.234.196.212,Female,1993-07-12,90244,80000,24,0.43,22882,True,,,3.6,51000.0,,,81,Female,1993-07-12,80000.0,24,0.43,22882,False,False,False,False,False,False
app_419,"[{'category': 'Healthcare', 'amount': 145}, {'category': 'Travel', 'amount': 174}, {'category': 'Rent', 'amount': 647}]",,Timothy Hernandez,timothy.hernandez1@outlook.com,937-93-2440,172.30.247.166,Male,1987-09-18,10096,125000,5,0.24,63180,False,algorithm_risk_score,,,,,,82,Male,1987-09-18,125000.0,5,0.24,63180,False,False,False,False,False,False
app_442,"[{'category': 'Healthcare', 'amount': 536}]",,Amanda Wright,amanda.wright91@mail.com,735-49-5306,192.168.34.15,Female,1972-12-18,90232,58000,88,0.11,13402,False,algorithm_risk_score,,,,,,83,Female,1972-12-18,58000.0,88,0.11,13402,False,False,False,False,False,False
app_493,"[{'category': 'Education', 'amount': 253}, {'category': 'Rent', 'amount': 509}, {'category': 'Transportation', 'amount': 413}]",,Katherine Jones,katherine.jones30@hotmail.com,815-55-6710,172.28.130.54,Female,1973-01-23,90245,100000,99,0.25,34716,True,,,4.1,24000.0,,,84,Female,1973-01-23,100000.0,99,0.25,34716,False,False,False,False,False,False
app_416,"[{'category': 'Entertainment', 'amount': 758}, {'category': 'Education', 'amount': 770}]",,Samuel Davis,samuel.davis97@mail.com,119-56-1715,10.203.158.136,Male,1981-10-11,10066,100000,59,0.2,46148,False,algorithm_risk_score,,,,,,85,Male,1981-10-11,100000.0,59,0.2,46148,False,False,False,False,False,False
app_119,"[{'category': 'Shopping', 'amount': 761}]",,Amy Hernandez,amy.hernandez98@protonmail.com,595-13-3321,172.30.159.145,Female,1991-12-21,90216,74000,0,0.45,24617,False,algorithm_risk_score,,,,,,86,Female,1991-12-21,74000.0,0,0.45,24617,False,False,False,False,False,False
app_240,"[{'category': 'Insurance', 'amount': 778}]",,Maria Wright,maria.wright71@protonmail.com,391-67-6469,192.168.197.60,Female,1974-11-27,90209,130000,83,0.14,59062,False,algorithm_risk_score,home_improvement,,,,,87,Female,1974-11-27,130000.0,83,0.14,59062,False,False,False,False,False,False
app_154,"[{'category': 'Education', 'amount': 60}]",2024-01-15T00:00:00Z,Michelle Perez,michelle.perez39@protonmail.com,372-23-4447,192.168.101.97,Female,12/16/1985,30015,119000,65,0.09,86849,True,,,6.5,15000.0,,,88,Female,1985-12-16,119000.0,65,0.09,86849,False,False,True,False,False,False
app_166,"[{'category': 'Insurance', 'amount': 685}]",2024-01-15T00:00:00Z,Amy Harris,amy.harris92@mail.com,262-99-5707,192.168.208.6,Female,1978-08-03,90247,118000,54,0.13,35023,False,algorithm_risk_score,,,,,,89,Female,1978-08-03,118000.0,54,0.13,35023,False,False,False,False,False,False
app_100,"[{'category': 'Utilities', 'amount': 184}, {'category': 'Dining', 'amount': 463}]",,George Campbell,george.campbell53@outlook.com,438-48-3242,172.29.10.254,M,1962-05-01,10001,79000,99,0.22,36346,True,,,2.8,19000.0,,,90,Male,1962-05-01,79000.0,99,0.22,36346,False,False,False,False,False,False
app_107,"[{'category': 'Dining', 'amount': 581}, {'category': 'Rent', 'amount': 857}]",,George Garcia,george.garcia38@outlook.com,565-34-4484,172.30.66.2,M,1960-01-12,10087,91000,105,0.3,37143,False,algorithm_risk_score,,,,,,91,Male,1960-01-12,91000.0,105,0.3,37143,False,False,False,False,False,False
app_088,"[{'category': 'Transportation', 'amount': 339}]",,Susan Martinez,susan.martinez83@protonmail.com,780-24-9300,172.23.224.13,F,1986-10-15,90229,55000,55,0.43,29118,False,algorithm_risk_score,,,,,,92,Female,1986-10-15,55000.0,55,0.43,29118,False,False,False,False,False,False
app_114,"[{'category': 'Groceries', 'amount': 819}, {'category': 'Travel', 'amount': 261}]",,Shirley Thompson,shirley.thompson14@hotmail.com,841-69-3137,172.20.125.54,Female,1991/03/01,90204,75000,52,0.12,23554,True,,,3.9,50000.0,,,93,Female,1991-01-03,75000.0,52,0.12,23554,False,False,True,False,False,False
app_421,"[{'category': 'Utilities', 'amount': 563}, {'category': 'Dining', 'amount': 861}]",,Donald Baker,donald.baker60@icloud.com,344-50-4287,192.168.147.249,Male,1982-07-17,10027,,44,0.06,5018,True,,,6.0,45000.0,46000.0,,94,Male,1982-07-17,,44,0.06,5018,False,False,False,False,False,False
app_323,"[{'category': 'Travel', 'amount': 133}, {'category': 'Education', 'amount': 65}]",,Michael Thompson,michael.thompson45@gmail.com,862-33-2796,172.26.169.208,Male,08/11/1981,10090,113000,92,0.4,27746,True,,,3.9,80000.0,,,95,Male,1981-11-08,113000.0,92,0.4,27746,False,False,True,False,False,False
app_288,"[{'category': 'Shopping', 'amount': 434}]",,Susan Young,susan.young22@mail.com,159-19-1765,192.168.114.250,Female,1962-11-05,90252,88000,71,0.27,23054,True,,,5.5,67000.0,,,96,Female,1962-11-05,88000.0,71,0.27,23054,False,False,False,False,False,False
app_396,"[{'category': 'Shopping', 'amount': 698}, {'category': 'Dining', 'amount': 284}, {'category': 'Groceries', 'amount': 206}]",,Katherine Harris,katherine.harris16@outlook.com,174-24-9597,10.14.75.95,Female,1976-01-28,10027,96000,124,0.2,33232,True,,,5.4,40000.0,,,97,Female,1976-01-28,96000.0,124,0.2,33232,False,False,False,False,False,False
app_371,"[{'category': 'Rent', 'amount': 180}, {'category': 'Groceries', 'amount': 823}]",,Sarah Walker,sarah.walker95@mail.com,142-97-2132,10.57.113.229,Female,1995-02-23,90250,76000,12,0.11,59032,False,algorithm_risk_score,,,,,,98,Female,1995-02-23,76000.0,12,0.11,59032,False,False,False,False,False,False
app_479,"[{'category': 'Transportation', 'amount': 136}]",,Sandra Jones,sandra.jones59@outlook.com,424-34-1670,172.25.239.70,F,1983/11/08,90205,,56,0.11,15630,False,algorithm_risk_score,,,,94000.0,,99,Female,1983-08-11,,56,0.11,15630,False,False,True,False,False,False
app_149,"[{'category': 'Utilities', 'amount': 570}, {'category': 'Dining', 'amount': 376}]",2024-01-15T00:00:00Z,Linda Nguyen,linda.nguyen56@protonmail.com,183-95-4538,10.251.107.38,Female,1978-11-10,90224,132000,72,0.2,48329,True,,,5.1,29000.0,,,100,Female,1978-11-10,132000.0,72,0.2,48329,False,False,False,False,False,False
app_260,"[{'category': 'Dining', 'amount': 636}, {'category': 'Utilities', 'amount': 100}, {'category': 'Travel', 'amount': 399}]",,Thomas Hill,thomas.hill26@aol.com,855-44-3925,10.149.26.211,M,09/10/1967,10035,36000,66,0.2,1358,False,algorithm_risk_score,,,,,,101,Male,1967-10-09,36000.0,66,0.2,1358,False,False,True,False,False,False
app_079,"[{'category': 'Utilities', 'amount': 815}, {'category': 'Dining', 'amount': 748}]",,Elizabeth Hernandez,elizabeth.hernandez71@yahoo.com,112-96-1187,192.168.93.154,Female,1972-12-28,90280,97000,102,0.31,32958,False,high_dti_ratio,,,,,,102,Female,1972-12-28,97000.0,102,0.31,32958,False,False,False,False,False,False
app_251,"[{'category': 'Groceries', 'amount': 580}, {'category': 'Travel', 'amount': 633}, {'category': 'Healthcare', 'amount': 575}]",,Daniel Nelson,daniel.nelson71@protonmail.com,418-57-7031,192.168.70.66,Male,1984-12-25,10096,98000,19,0.31,27789,False,algorithm_risk_score,,,,,,103,Male,1984-12-25,98000.0,19,0.31,27789,False,False,False,False,False,False
app_404,"[{'category': 'Insurance', 'amount': 841}, {'category': 'Fitness', 'amount': 325}]",,Thomas Mitchell,thomas.mitchell21@aol.com,543-21-6993,172.30.59.137,Male,1985-11-10,10017,91000,31,0.32,2729,True,,,5.9,69000.0,,,104,Male,1985-11-10,91000.0,31,0.32,2729,False,False,False,False,False,False
app_247,"[{'category': 'Rent', 'amount': 594}, {'category': 'Healthcare', 'amount': 530}]",,Dorothy Torres,dorothy.torres17@aol.com,850-95-2871,192.168.138.165,Female,1999/06/16,90231,64000,0,0.21,22335,False,algorithm_risk_score,wedding,,,,,105,Female,1999-06-16,64000.0,0,0.21,22335,False,False,True,False,False,False
app_162,"[{'category': 'Dining', 'amount': 303}, {'category': 'Entertainment', 'amount': 197}, {'category': 'Fitness', 'amount': 617}]",2024-01-15T00:00:00Z,Eric Rodriguez,eric.rodriguez1@hotmail.com,122-21-5695,10.53.239.200,Male,1991-12-11,10066,55000,47,0.3,10407,True,,,2.7,71000.0,,,106,Male,1991-12-11,55000.0,47,0.3,10407,False,False,False,False,False,False
app_029,"[{'category': 'Dining', 'amount': 258}]",,Rebecca Jackson,rebecca.jackson30@icloud.com,756-86-3510,172.31.169.14,F,2001-03-23,10035,46000,37,0.45,23075,True,,,3.1,48000.0,,,107,Female,2001-03-23,46000.0,37,0.45,23075,False,False,False,False,False,False
app_345,"[{'category': 'Dining', 'amount': 122}]",,Justin White,justin.white92@yahoo.com,845-23-1957,192.168.91.204,Male,1978-08-20,10041,60000,42,0.34,25288,False,algorithm_risk_score,,,,,,108,Male,1978-08-20,60000.0,42,0.34,25288,False,False,False,False,False,False
app_059,"[{'category': 'Rent', 'amount': 234}]",,Jack Lewis,jack.lewis27@hotmail.com,134-13-3673,10.132.239.142,Male,1992/11/21,10029,103000,50,0.3,40581,False,algorithm_risk_score,,,,,,109,Male,1992-11-21,103000.0,50,0.3,40581,False,False,True,False,False,False
app_484,"[{'category': 'Insurance', 'amount': 286}, {'category': 'Travel', 'amount': 693}]",,Samuel Green,samuel.green79@gmail.com,497-67-8063,10.113.219.15,Male,1990-08-10,10001,69000,27,0.27,10775,True,,,3.2,34000.0,,,110,Male,1990-08-10,69000.0,27,0.27,10775,False,False,False,False,False,False
app_346,"[{'category': 'Transportation', 'amount': 752}]",,Gary Martinez,gary.martinez58@protonmail.com,986-28-6936,172.21.15.191,Male,1979-10-29,90276,140000,60,0.25,38125,False,algorithm_risk_score,,,,,,111,Male,1979-10-29,140000.0,60,0.25,38125,False,False,False,False,False,False
app_297,"[{'category': 'Dining', 'amount': 897}, {'category': 'Groceries', 'amount': 693}]",,Daniel Green,daniel.green70@gmail.com,845-77-4845,172.29.27.236,Male,02/18/1983,10028,81000,84,0.38,30102,True,,,3.5,58000.0,,,112,Male,1983-02-18,81000.0,84,0.38,30102,False,False,True,False,False,False
app_223,"[{'category': 'Groceries', 'amount': 112}]",,Edward Nguyen,edward.nguyen90@yahoo.com,728-35-5170,10.162.20.136,Male,2000/12/28,10040,57000,0,0.26,4528,True,,medical,5.1,40000.0,,,113,Male,2000-12-28,57000.0,0,0.26,4528,False,False,True,False,False,False
app_052,"[{'category': 'Rent', 'amount': 328}]",,Kenneth Campbell,kenneth.campbell16@protonmail.com,255-10-9021,192.168.174.67,Male,1965-05-05,10052,91000,119,0.11,38008,True,,,3.0,22000.0,,,114,Male,1965-05-05,91000.0,119,0.11,38008,False,False,False,False,False,False
app_261,"[{'category': 'Transportation', 'amount': 252}, {'category': 'Travel', 'amount': 352}]",,Raymond Hall,raymond.hall45@hotmail.com,129-78-7265,10.137.212.135,M,12/28/1972,10041,63000,59,0.38,23287,False,algorithm_risk_score,,,,,,115,Male,1972-12-28,63000.0,59,0.38,23287,False,False,True,False,False,False
app_407,"[{'category': 'Entertainment', 'amount': 52}, {'category': 'Fitness', 'amount': 606}, {'category': 'Insurance', 'amount': 781}]",,Jacob Ramirez,jacob.ramirez30@aol.com,458-36-1005,192.168.53.145,Male,1990/11/09,10076,74000,31,0.26,32341,False,algorithm_risk_score,,,,,,116,Male,1990-09-11,74000.0,31,0.26,32341,False,False,True,False,False,False
app_014,"[{'category': 'Dining', 'amount': 339}]",,Pamela Gonzalez,pamela.gonzalez4@mail.com,622-41-3198,192.168.120.82,Female,14/01/1995,10086,112000,35,0.45,9647,False,algorithm_risk_score,,,,,,117,Female,1995-01-14,112000.0,35,0.45,9647,False,False,True,False,False,False
app_143,"[{'category': 'Groceries', 'amount': 791}]",2024-01-15T00:00:00Z,David Wilson,david.wilson94@hotmail.com,855-76-9652,192.168.180.240,Male,1958-12-21,10048,66000,113,0.28,23503,True,,,6.4,66000.0,,,118,Male,1958-12-21,66000.0,113,0.28,23503,False,False,False,False,False,False
app_036,"[{'category': 'Dining', 'amount': 723}]",,Betty Hall,betty.hall38@hotmail.com,427-27-7779,10.141.198.139,Female,1988-03-31,90227,141000,18,0.4,77318,True,,,3.3,49000.0,,,119,Female,1988-03-31,141000.0,18,0.4,77318,False,False,False,False,False,False
app_145,"[{'category': 'Utilities', 'amount': 826}]",2024-01-15T00:00:00Z,Carolyn Robinson,carolyn.robinson18@outlook.com,887-80-6350,10.99.68.231,Female,04/10/1990,90297,85000,26,0.43,17930,False,algorithm_risk_score,,,,,,120,Female,1990-10-04,85000.0,26,0.43,17930,False,False,True,False,False,False
app_128,"[{'category': 'Fitness', 'amount': 199}]",,Thomas Scott,thomas.scott58@mail.com,857-88-7567,10.5.184.205,Male,1985-04-02,10078,94000,81,0.4,73842,False,high_dti_ratio,,,,,,121,Male,1985-04-02,94000.0,81,0.4,73842,False,False,False,False,False,False
app_016,"[{'category': 'Groceries', 'amount': 485}]",,Gary Wilson,gary.wilson85@yahoo.com,780-24-9300,192.168.20.42,M,1959-12-11,10091,123000,71,0.37,86599,False,algorithm_risk_score,,,,,,122,Male,1959-12-11,123000.0,71,0.37,86599,False,False,False,False,False,False
app_144,"[{'category': 'Fitness', 'amount': 513}]",2024-01-15T00:00:00Z,Nicholas Taylor,nicholas.taylor14@icloud.com,745-28-4842,10.176.136.112,Male,1996-09-14,10024,56000,0,0.27,23970,True,,,6.2,39000.0,,,123,Male,1996-09-14,56000.0,0,0.27,23970,False,False,False,False,False,False
app_134,"[{'category': 'Groceries', 'amount': 595}]",,Brandon Moore,brandon.moore99@aol.com,714-64-1550,10.236.143.233,Male,06/10/1993,10048,98000,60,0.12,24889,True,,,6.0,69000.0,,,124,Male,1993-10-06,98000.0,60,0.12,24889,False,False,True,False,False,False
app_238,"[{'category': 'Fitness', 'amount': 666}, {'category': 'Entertainment', 'amount': 708}, {'category': 'Dining', 'amount': 720}]",,Andrew Carter,andrew.carter41@protonmail.com,760-94-9485,10.39.210.182,Male,11/03/1988,10057,131000,112,0.17,65612,False,algorithm_risk_score,business,,,,,125,Male,1988-03-11,131000.0,112,0.17,65612,False,False,True,False,False,False
app_270,"[{'category': 'Travel', 'amount': 150}]",,Debra Flores,debra.flores69@protonmail.com,911-30-4999,172.24.233.43,Female,1993-10-19,10098,58000,78,0.24,14687,False,algorithm_risk_score,,,,,,126,Female,1993-10-19,58000.0,78,0.24,14687,False,False,False,False,False,False
app_151,"[{'category': 'Utilities', 'amount': 786}]",2024-01-15T00:00:00Z,James Young,james.young39@outlook.com,582-51-4265,192.168.53.146,M,1988-01-11,10019,124000,59,0.4,53225,False,algorithm_risk_score,,,,,,127,Male,1988-01-11,124000.0,59,0.4,53225,False,False,False,False,False,False
app_382,"[{'category': 'Travel', 'amount': 838}, {'category': 'Insurance', 'amount': 415}, {'category': 'Utilities', 'amount': 545}]",,Charles White,charles.white70@aol.com,160-88-7527,192.168.185.92,Male,1994-10-01,10091,102000,12,0.42,26781,True,,,5.8,22000.0,,,128,Male,1994-10-01,102000.0,12,0.42,26781,False,False,False,False,False,False
app_351,"[{'category': 'Entertainment', 'amount': 809}]",2025-12-01T00:00:00Z,Gary Young,gary.young30@outlook.com,542-27-3301,10.156.74.115,Male,1995-04-14,30029,67000,9,0.12,26062,False,algorithm_risk_score,,,,,,129,Male,1995-04-14,67000.0,9,0.12,26062,False,False,False,False,False,False
app_071,"[{'category': 'Utilities', 'amount': 719}, {'category': 'Rent', 'amount': 877}]",,Debra Wilson,debra.wilson10@mail.com,542-49-2109,192.168.24.61,F,1978-02-03,90208,134000,69,0.07,72178,True,,,3.8,54000.0,,,130,Female,1978-02-03,134000.0,69,0.07,72178,False,False,False,False,False,False
app_057,"[{'category': 'Education', 'amount': 320}, {'category': 'Healthcare', 'amount': 488}]",,Betty Smith,betty.smith71@yahoo.com,848-93-7847,10.30.94.229,Female,1990/11/08,90255,70000,42,0.15,38800,True,,,2.5,55000.0,,,131,Female,1990-08-11,70000.0,42,0.15,38800,False,False,True,False,False,False
app_278,"[{'category': 'Fitness', 'amount': 414}]",,Sarah Gonzalez,sarah.gonzalez66@yahoo.com,975-14-1465,10.133.35.59,Female,1997-05-21,10024,56000,0,0.28,9221,False,algorithm_risk_score,,,,,,132,Female,1997-05-21,56000.0,0,0.28,9221,False,False,False,False,False,False
app_391,"[{'category': 'Education', 'amount': 461}]",,Jeffrey Perez,jeffrey.perez3@outlook.com,749-47-1082,192.168.93.38,Male,29/03/1963,10044,69000,131,0.19,37029,True,,,4.9,65000.0,,,133,Male,1963-03-29,69000.0,131,0.19,37029,False,False,True,False,False,False
app_271,"[{'category': 'Travel', 'amount': 54}, {'category': 'Utilities', 'amount': 74}]",,Katherine Lopez,katherine.lopez84@gmail.com,696-78-1129,192.168.120.3,Female,07/28/1988,90273,95000,44,0.35,34950,True,,,5.8,17000.0,,,134,Female,1988-07-28,95000.0,44,0.35,34950,False,False,True,False,False,False
app_170,"[{'category': 'Rent', 'amount': 696}, {'category': 'Fitness', 'amount': 699}]",2024-01-15T00:00:00Z,Ryan Lopez,ryan.lopez76@outlook.com,907-21-8853,10.160.161.230,Male,1990-02-19,30015,75000,40,0.18,10709,True,,,3.3,79000.0,,,135,Male,1990-02-19,75000.0,40,0.18,10709,False,False,False,False,False,False
app_005,"[{'category': 'Insurance', 'amount': 585}]",,Christine Mitchell,christine.mitchell3@outlook.com,400-91-8156,172.25.44.173,Female,1960/06/19,90296,39000,76,0.06,15011,False,algorithm_risk_score,,,,,,136,Female,1960-06-19,39000.0,76,0.06,15011,False,False,True,False,False,False
app_043,"[{'category': 'Groceries', 'amount': 398}, {'category': 'Entertainment', 'amount': 464}]",,Daniel King,daniel.king27@mail.com,166-23-2000,10.204.248.60,Male,1985-08-17,10038,131000,-10,0.06,53098,True,,,3.9,68000.0,,,137,Male,1985-08-17,131000.0,-10,0.06,53098,False,False,False,True,False,False
app_204,"[{'category': 'Travel', 'amount': 778}]",,Jonathan Carter,mike johnson@gmail.com,972-81-1928,10.77.72.174,Male,1983-04-12,90256,81000,63,0.22,14018,False,algorithm_risk_score,vacation,,,,,138,Male,1983-04-12,81000.0,63,0.22,14018,False,True,False,False,False,False
app_465,"[{'category': 'Entertainment', 'amount': 205}]",,James Rivera,james.rivera15@outlook.com,853-96-1952,192.168.175.28,Male,1972-05-29,10041,72000,89,0.32,27863,True,,,5.7,20000.0,,,139,Male,1972-05-29,72000.0,89,0.32,27863,False,False,False,False,False,False
app_448,"[{'category': 'Entertainment', 'amount': 83}]",,Susan Flores,susan.flores60@mail.com,383-48-9078,172.26.210.172,Female,1983-12-17,90221,57000,22,0.23,12120,True,,,6.4,47000.0,,,140,Female,1983-12-17,57000.0,22,0.23,12120,False,False,False,False,False,False
app_463,"[{'category': 'Travel', 'amount': 690}, {'category': 'Transportation', 'amount': 229}]",,Emma Clark,emma.clark61@outlook.com,976-47-3536,10.194.129.196,Female,1975-04-26,90205,,50,0.29,66878,False,algorithm_risk_score,,,,86000.0,,141,Female,1975-04-26,,50,0.29,66878,False,False,False,False,False,False
app_109,"[{'category': 'Fitness', 'amount': 67}, {'category': 'Travel', 'amount': 772}, {'category': 'Rent', 'amount': 715}]",,Anna Davis,anna.davis94@mail.com,239-98-1268,10.105.58.146,Female,2000-01-03,90278,47000,27,0.23,17289,True,,,4.0,17000.0,,,142,Female,2000-01-03,47000.0,27,0.23,17289,False,False,False,False,False,False
app_444,"[{'category': 'Shopping', 'amount': 303}, {'category': 'Insurance', 'amount': 509}, {'category': 'Dining', 'amount': 291}]",,Brandon Brown,brandon.brown2@hotmail.com,761-72-9912,10.4.242.163,Male,1981/10/28,10077,91000,56,0.23,28670,True,,,5.5,59000.0,,,143,Male,1981-10-28,91000.0,56,0.23,28670,False,False,True,False,False,False
app_412,"[{'category': 'Rent', 'amount': 334}]",,Alexander Wright,alexander.wright47@hotmail.com,912-89-2986,10.158.159.60,Male,1997-02-16,10096,53000,61,0.43,25452,False,high_dti_ratio,,,,,,144,Male,1997-02-16,53000.0,61,0.43,25452,False,False,False,False,False,False
app_092,"[{'category': 'Fitness', 'amount': 330}]",,Linda Jones,linda.jones69@hotmail.com,671-44-4118,10.218.56.39,Female,1997-09-29,90222,22000,31,0.4,14473,True,,,5.5,29000.0,,,145,Female,1997-09-29,22000.0,31,0.4,14473,False,False,False,False,False,False
app_135,"[{'category': 'Healthcare', 'amount': 255}, {'category': 'Travel', 'amount': 222}]",,Laura Wilson,laura.wilson90@outlook.com,754-90-5869,10.172.73.55,Female,1986-10-23,90202,65000,92,0.22,9369,False,algorithm_risk_score,,,,,,146,Female,1986-10-23,65000.0,92,0.22,9369,False,False,False,False,False,False
app_104,"[{'category': 'Healthcare', 'amount': 425}]",,Maria Adams,maria.adams22@aol.com,186-65-7168,10.130.39.7,Female,1972-09-25,90254,84000,85,0.35,32846,True,,,3.6,76000.0,,,147,Female,1972-09-25,84000.0,85,0.35,32846,False,False,False,False,False,False
app_394,"[{'category': 'Groceries', 'amount': 395}, {'category': 'Dining', 'amount': 545}]",,Karen Robinson,karen.robinson34@gmail.com,949-81-1792,192.168.66.232,Female,1998-09-02,90271,61000,54,0.16,16646,False,algorithm_risk_score,,,,,,148,Female,1998-09-02,61000.0,54,0.16,16646,False,False,False,False,False,False
app_449,"[{'category': 'Insurance', 'amount': 498}]",,Lisa Roberts,lisa.roberts99@outlook.com,833-71-7935,172.23.144.234,Female,1968-11-09,90234,,86,0.07,27467,True,,,5.7,54000.0,75000.0,,149,Female,1968-11-09,,86,0.07,27467,False,False,False,False,False,False
app_255,"[{'category': 'Entertainment', 'amount': 98}, {'category': 'Alcohol', 'amount': 229}]",,Larry Ramirez,larry.ramirez85@mail.com,646-37-3934,192.168.14.184,Male,1991/08/05,10083,59000,32,0.07,13853,True,,,4.8,55000.0,,,150,Male,1991-05-08,59000.0,32,0.07,13853,False,False,True,False,False,False
app_365,"[{'category': 'Insurance', 'amount': 763}]",,Donald Ramirez,donald.ramirez2@protonmail.com,639-74-5472,192.168.85.102,M,1989-04-20,10043,79000,53,0.08,10899,True,,,2.6,29000.0,,,151,Male,1989-04-20,79000.0,53,0.08,10899,False,False,False,False,False,False
app_500,"[{'category': 'Transportation', 'amount': 451}]",,Gregory Robinson,gregory.robinson44@gmail.com,195-84-3232,192.168.9.203,M,1991-02-27,10048,86000,12,0.13,42908,True,,,5.2,38000.0,,,152,Male,1991-02-27,86000.0,12,0.13,42908,False,False,False,False,False,False
app_110,"[{'category': 'Groceries', 'amount': 316}, {'category': 'Education', 'amount': 181}]",,Mark Campbell,mark.campbell54@icloud.com,223-83-4934,192.168.251.236,Male,1962-07-07,10011,111000,112,0.07,58086,True,,,3.4,78000.0,,,153,Male,1962-07-07,111000.0,112,0.07,58086,False,False,False,False,False,False
app_335,"[{'category': 'Insurance', 'amount': 327}]",,Matthew Johnson,matthew.johnson43@protonmail.com,520-53-3058,10.184.100.56,Male,29/01/1977,10092,83000,75,0.16,57065,True,,,3.9,24000.0,,,154,Male,1977-01-29,83000.0,75,0.16,57065,False,False,True,False,False,False
app_490,"[{'category': 'Entertainment', 'amount': 753}, {'category': 'Healthcare', 'amount': 478}]",,Catherine King,catherine.king79@gmail.com,305-93-9799,172.29.194.13,Female,1987/04/13,90251,171000,74,0.26,45864,False,algorithm_risk_score,,,,,,155,Female,1987-04-13,171000.0,74,0.26,45864,False,False,True,False,False,False
app_258,"[{'category': 'Education', 'amount': 661}, {'category': 'Insurance', 'amount': 599}, {'category': 'Healthcare', 'amount': 109}]",,Laura Thompson,laura.thompson44@protonmail.com,112-40-9635,10.248.44.99,Female,1975-04-14,90273,71000,119,0.19,21151,True,,,6.5,73000.0,,,156,Female,1975-04-14,71000.0,119,0.19,21151,False,False,False,False,False,False
app_262,"[{'category': 'Dining', 'amount': 760}]",,Lisa Nelson,lisa.nelson41@protonmail.com,141-88-9385,172.31.49.104,F,1999-09-28,90264,46000,38,0.09,18075,False,algorithm_risk_score,,,,,,157,Female,1999-09-28,46000.0,38,0.09,18075,False,False,False,False,False,False
app_303,"[{'category': 'Insurance', 'amount': 373}, {'category': 'Healthcare', 'amount': 436}, {'category': 'Groceries', 'amount': 471}]",,Catherine Smith,catherine.smith85@outlook.com,961-32-4455,192.168.65.3,Female,1998-03-12,90281,41000,67,0.41,9650,False,algorithm_risk_score,,,,,,158,Female,1998-03-12,41000.0,67,0.41,9650,False,False,False,False,False,False
app_290,"[{'category': 'Fitness', 'amount': 599}]",,Stephanie Perez,stephanie.perez69@gmail.com,866-48-3726,172.25.130.219,Female,1990-01-06,90221,104000,39,0.27,-5000,True,,,4.3,49000.0,,,159,Female,1990-01-06,104000.0,39,0.27,-5000,False,False,False,False,False,True
app_073,"[{'category': 'Transportation', 'amount': 518}, {'category': 'Education', 'amount': 511}]",,Susan Flores,susan.flores83@gmail.com,470-84-5617,10.4.117.75,Female,1985/02/02,90252,97000,60,0.08,30412,True,,,4.8,51000.0,,,160,Female,1985-02-02,97000.0,60,0.08,30412,False,False,True,False,False,False
app_201,"[{'category': 'Healthcare', 'amount': 602}]",,James Baker,james.baker60@yahoo.com,703-96-2898,10.138.254.4,Male,1996-12-31,10088,36000,27,0.11,11695,False,algorithm_risk_score,home_improvement,,,,,161,Male,1996-12-31,36000.0,27,0.11,11695,False,False,False,False,False,False
app_156,"[{'category': 'Rent', 'amount': 218}]",2024-01-15T00:00:00Z,Jessica Green,jessica.green86@gmail.com,801-19-4595,192.168.59.201,Female,1999-11-28,90239,25000,-3,0.21,13641,False,algorithm_risk_score,,,,,,162,Female,1999-11-28,25000.0,-3,0.21,13641,False,False,False,True,False,False
app_193,"[{'category': 'Education', 'amount': 638}, {'category': 'Adult Entertainment', 'amount': 322}]",2024-01-15T00:00:00Z,Rachel King,rachel.king61@gmail.com,852-24-1787,10.39.214.38,Female,1984-08-02,90221,155000,9,0.08,30968,False,insufficient_credit_history,,,,,,163,Female,1984-08-02,155000.0,9,0.08,30968,False,False,False,False,False,False
app_294,"[{'category': 'Education', 'amount': 484}]",,Susan King,susan.king68@aol.com,678-39-1724,192.168.87.207,Female,1985-03-13,90298,120000,15,0.36,36582,False,high_dti_ratio,,,,,,164,Female,1985-03-13,120000.0,15,0.36,36582,False,False,False,False,False,False
app_226,"[{'category': 'Travel', 'amount': 726}]",,Susan Flores,susan.flores95@mail.com,817-96-6416,192.168.196.9,Female,1982/04/18,90231,148000,61,0.17,66276,True,,vacation,6.1,46000.0,,,165,Female,1982-04-18,148000.0,61,0.17,66276,False,False,True,False,False,False
app_033,"[{'category': 'Shopping', 'amount': 185}]",,Barbara Anderson,barbara.anderson27@hotmail.com,564-99-3399,192.168.114.161,Female,1993-12-10,30047,83000,73,0.1,27950,True,,,6.0,51000.0,,,166,Female,1993-12-10,83000.0,73,0.1,27950,False,False,False,False,False,False
app_429,"[{'category': 'Travel', 'amount': 498}]",,Patricia Perez,patricia.perez24@gmail.com,292-99-2030,172.17.194.147,Female,1996/02/26,90286,77000,41,0.18,26023,False,algorithm_risk_score,,,,,,167,Female,1996-02-26,77000.0,41,0.18,26023,False,False,True,False,False,False
app_172,"[{'category': 'Rent', 'amount': 809}]",2024-01-15T00:00:00Z,Rachel Sanchez,rachel.sanchez78@hotmail.com,557-61-9414,10.130.95.22,Female,1988-11-17,90213,64000,14,0.14,31122,False,algorithm_risk_score,,,,,,168,Female,1988-11-17,64000.0,14,0.14,31122,False,False,False,False,False,False
app_179,"[{'category': 'Utilities', 'amount': 842}, {'category': 'Healthcare', 'amount': 392}]",2026-03-15T00:00:00Z,Paul Roberts,paul.roberts46@yahoo.com,880-83-3129,172.21.233.185,Male,12/07/1993,10092,85000,30,0.24,31966,True,,,3.4,42000.0,,,169,Male,1993-07-12,85000.0,30,0.24,31966,False,False,True,False,False,False
app_283,"[{'category': 'Dining', 'amount': 648}]",,Cynthia Johnson,cynthia.johnson21@protonmail.com,321-71-4810,10.23.78.49,F,1990-12-27,10055,70000,5,0.09,34596,False,algorithm_risk_score,,,,,,170,Female,1990-12-27,70000.0,5,0.09,34596,False,False,False,False,False,False
app_446,"[{'category': 'Travel', 'amount': 650}, {'category': 'Transportation', 'amount': 899}]",,Ronald King,ronald.king78@protonmail.com,352-74-8563,192.168.40.222,Male,16/04/1998,10015,73000,19,0.31,47962,True,,,3.4,20000.0,,,171,Male,1998-04-16,73000.0,19,0.31,47962,False,False,True,False,False,False
app_454,"[{'category': 'Travel', 'amount': 592}]",,Sharon Jackson,sharon.jackson27@outlook.com,953-65-4954,172.28.143.211,Female,1980-04-05,90219,99000,74,0.18,32988,True,,,5.3,76000.0,,,172,Female,1980-04-05,99000.0,74,0.18,32988,False,False,False,False,False,False
app_027,"[{'category': 'Groceries', 'amount': 576}]",,Nicole Taylor,nicole.taylor83@icloud.com,518-58-6736,192.168.213.217,Female,1994-04-05,90214,75000,16,0.28,31461,False,insufficient_credit_history,,,,,,173,Female,1994-04-05,75000.0,16,0.28,31461,False,False,False,False,False,False
app_376,"[{'category': 'Education', 'amount': 212}]",,Brenda Young,brenda.young74@gmail.com,985-67-3351,172.22.235.81,Female,01/10/1968,90283,82000,96,0.2,33059,False,algorithm_risk_score,,,,,,174,Female,1968-10-01,82000.0,96,0.2,33059,False,False,True,False,False,False
app_083,"[{'category': 'Groceries', 'amount': 375}, {'category': 'Shopping', 'amount': 180}, {'category': 'Transportation', 'amount': 571}]",,Justin Walker,justin.walker56@gmail.com,423-24-4926,172.27.230.121,M,1989-11-04,10069,57000,40,0.23,29607,False,algorithm_risk_score,,,,,,175,Male,1989-11-04,57000.0,40,0.23,29607,False,False,False,False,False,False
app_379,"[{'category': 'Groceries', 'amount': 806}, {'category': 'Shopping', 'amount': 323}]",,Alexander Scott,alexander.scott21@outlook.com,103-99-1167,10.179.246.181,Male,1987-10-23,10019,103000,31,0.42,44360,False,algorithm_risk_score,,,,,,176,Male,1987-10-23,103000.0,31,0.42,44360,False,False,False,False,False,False
app_072,"[{'category': 'Travel', 'amount': 388}]",,Kimberly Anderson,kimberly.anderson44@mail.com,534-80-4167,172.23.107.141,Female,1998-03-14,30044,65000,20,0.28,19076,False,insufficient_credit_history,,,,,,177,Female,1998-03-14,65000.0,20,0.28,19076,False,False,False,False,False,False
app_408,"[{'category': 'Fitness', 'amount': 406}, {'category': 'Utilities', 'amount': 342}]",,Raymond Garcia,raymond.garcia80@mail.com,774-49-4143,172.27.203.107,Male,1969-09-27,30022,74000,53,0.38,29820,True,,,4.8,37000.0,,,178,Male,1969-09-27,74000.0,53,0.38,29820,False,False,False,False,False,False
app_384,"[{'category': 'Groceries', 'amount': 415}]",,Joshua Walker,joshua.walker25@hotmail.com,556-25-7621,172.28.91.31,M,1997/02/27,10004,46000,3,0.06,9529,True,,,2.6,60000.0,,,179,Male,1997-02-27,46000.0,3,0.06,9529,False,False,True,False,False,False
app_070,"[{'category': 'Dining', 'amount': 168}]",,Karen Rodriguez,karen.rodriguez76@yahoo.com,809-96-3820,172.22.141.14,Female,1980/09/02,90292,121000,59,0.43,24655,False,algorithm_risk_score,,,,,,180,Female,1980-02-09,121000.0,59,0.43,24655,False,False,True,False,False,False
app_299,"[{'category': 'Dining', 'amount': 854}, {'category': 'Healthcare', 'amount': 787}, {'category': 'Groceries', 'amount': 531}]",,Samuel Gonzalez,test.user.outlook.com,626-69-8549,172.29.212.150,Male,1972-08-28,10054,64000,58,0.18,23101,False,algorithm_risk_score,,,,,,181,Male,1972-08-28,64000.0,58,0.18,23101,False,True,False,False,False,False
app_056,"[{'category': 'Healthcare', 'amount': 306}, {'category': 'Groceries', 'amount': 634}]",,Kenneth Hall,kenneth.hall2@mail.com,195-78-2598,192.168.194.157,Male,1980-12-24,10069,99000,37,0.35,33129,False,algorithm_risk_score,,,,,,182,Male,1980-12-24,99000.0,37,0.35,33129,False,False,False,False,False,False
app_245,"[{'category': 'Travel', 'amount': 162}, {'category': 'Entertainment', 'amount': 476}]",,Jason Hernandez,jason.hernandez70@yahoo.com,352-47-5158,192.168.154.147,M,06/25/1994,10038,97000,30,0.26,26829,True,,debt_consolidation,4.0,44000.0,,,183,Male,1994-06-25,97000.0,30,0.26,26829,False,False,True,False,False,False
app_489,"[{'category': 'Utilities', 'amount': 640}, {'category': 'Rent', 'amount': 894}]",,Barbara Johnson,barbara.johnson68@gmail.com,413-10-2568,10.64.32.85,Female,1966-07-25,90284,47000,84,0.06,14947,False,low_income,,,,,,184,Female,1966-07-25,47000.0,84,0.06,14947,False,False,False,False,False,False
app_230,"[{'category': 'Education', 'amount': 867}]",,Cynthia Flores,cynthia.flores14@outlook.com,726-19-5382,10.145.124.45,Female,1963-05-21,90291,63000,133,0.19,14427,True,,medical,5.3,71000.0,,,185,Female,1963-05-21,63000.0,133,0.19,14427,False,False,False,False,False,False
app_216,"[{'category': 'Groceries', 'amount': 230}, {'category': 'Insurance', 'amount': 210}]",,Jason Moore,jason.moore86@aol.com,308-39-2669,192.168.11.119,Male,1980-07-20,10020,111000,77,0.37,61470,True,,wedding,5.8,42000.0,,,186,Male,1980-07-20,111000.0,77,0.37,61470,False,False,False,False,False,False
app_413,"[{'category': 'Rent', 'amount': 856}]",,Anthony Jackson,,584-37-2562,172.20.164.12,Male,1986-10-21,10044,92000,30,0.3,41179,True,,,6.2,41000.0,,,187,Male,1986-10-21,92000.0,30,0.3,41179,False,False,False,False,False,False
app_252,"[{'category': 'Entertainment', 'amount': 784}, {'category': 'Rent', 'amount': 897}, {'category': 'Education', 'amount': 147}]",,Christine Torres,christine.torres96@yahoo.com,307-76-8036,10.121.126.37,F,2001-12-23,90270,31000,29,0.44,10534,False,insufficient_credit_history,,,,,,188,Female,2001-12-23,31000.0,29,0.44,10534,False,False,False,False,False,False
app_347,"[{'category': 'Education', 'amount': 65}]",,Matthew Martinez,matthew.martinez83@outlook.com,365-28-4231,192.168.106.31,Male,1979-01-04,10094,80000,42,0.38,17742,True,,,6.3,38000.0,,,189,Male,1979-01-04,80000.0,42,0.38,17742,False,False,False,False,False,False
app_435,"[{'category': 'Shopping', 'amount': 663}]",,Joseph Robinson,joseph.robinson60@yahoo.com,681-82-8445,10.152.220.19,Male,1985-04-25,10077,89000,51,0.22,11727,True,,,5.6,51000.0,,,190,Male,1985-04-25,89000.0,51,0.22,11727,False,False,False,False,False,False
app_498,"[{'category': 'Education', 'amount': 177}, {'category': 'Fitness', 'amount': 93}]",,James Rivera,james.rivera25@gmail.com,942-34-6834,172.18.221.237,Male,1989-10-19,90276,86000,33,0.29,36901,False,algorithm_risk_score,,,,,,191,Male,1989-10-19,86000.0,33,0.29,36901,False,False,False,False,False,False
app_364,"[{'category': 'Transportation', 'amount': 401}]",,Sarah Jones,sarah.jones80@gmail.com,201-26-8876,192.168.154.187,F,1967-10-27,90270,69000,49,0.27,36070,True,,,6.2,27000.0,,,192,Female,1967-10-27,69000.0,49,0.27,36070,False,False,False,False,False,False
app_254,"[{'category': 'Groceries', 'amount': 691}]",,Dennis Torres,dennis.torres14@icloud.com,521-92-4764,10.120.100.163,Male,1981-09-28,10003,77000,31,0.4,29666,True,,,2.9,46000.0,,,193,Male,1981-09-28,77000.0,31,0.4,29666,False,False,False,False,False,False
app_106,"[{'category': 'Fitness', 'amount': 317}, {'category': 'Rent', 'amount': 319}]",,Michael White,michael.white97@mail.com,285-12-3751,192.168.62.179,Male,1999-08-28,10043,44000,20,0.16,13124,False,algorithm_risk_score,,,,,,194,Male,1999-08-28,44000.0,20,0.16,13124,False,False,False,False,False,False
app_475,"[{'category': 'Utilities', 'amount': 460}]",,Dorothy Anderson,dorothy.anderson57@outlook.com,289-90-8282,192.168.143.36,Female,1982-06-29,90296,108000,43,0.36,24107,True,,,4.5,61000.0,,,195,Female,1982-06-29,108000.0,43,0.36,24107,False,False,False,False,False,False
app_117,"[{'category': 'Education', 'amount': 339}]",,Joshua Lee,joshua.lee75@aol.com,899-51-8077,10.112.253.70,Male,1981-06-20,10002,69000,109,0.21,22879,True,,,5.9,77000.0,,,196,Male,1981-06-20,69000.0,109,0.21,22879,False,False,False,False,False,False
app_474,"[{'category': 'Education', 'amount': 54}, {'category': 'Healthcare', 'amount': 92}]",,Sharon Hall,sharon.hall52@mail.com,580-66-6265,172.22.85.37,F,1996-08-21,90242,40000,51,0.19,13712,False,algorithm_risk_score,,,,,,197,Female,1996-08-21,40000.0,51,0.19,13712,False,False,False,False,False,False
app_205,"[{'category': 'Entertainment', 'amount': 821}, {'category': 'Utilities', 'amount': 727}]",,Anna Rodriguez,anna.rodriguez64@hotmail.com,676-49-1041,10.244.192.51,Female,1985-06-02,90267,66000,53,0.25,23205,False,algorithm_risk_score,vacation,,,,,198,Female,1985-06-02,66000.0,53,0.25,23205,False,False,False,False,False,False
app_477,"[{'category': 'Groceries', 'amount': 343}, {'category': 'Transportation', 'amount': 340}]",,Dennis White,dennis.white80@yahoo.com,586-69-8442,192.168.193.44,Male,1992-08-07,10096,82000,12,0.42,22805,False,algorithm_risk_score,,,,,,199,Male,1992-08-07,82000.0,12,0.42,22805,False,False,False,False,False,False
app_338,"[{'category': 'Healthcare', 'amount': 818}]",,Stephanie Davis,stephanie.davis2@icloud.com,720-23-7583,192.168.65.96,Female,1983-10-26,90285,132000,82,0.14,42137,True,,,5.7,67000.0,,,200,Female,1983-10-26,132000.0,82,0.14,42137,False,False,False,False,False,False
app_430,"[{'category': 'Insurance', 'amount': 748}]",,Anna Mitchell,anna.mitchell67@gmail.com,510-73-7761,192.168.140.42,F,21/04/1979,10066,97000,28,0.19,17717,False,algorithm_risk_score,,,,,,201,Female,1979-04-21,97000.0,28,0.19,17717,False,False,True,False,False,False
app_330,"[{'category': 'Travel', 'amount': 885}]",,Scott Brown,scott.brown39@hotmail.com,415-46-6409,192.168.147.254,Male,1980-09-19,10026,136000,1,0.28,35500,False,algorithm_risk_score,,,,,,202,Male,1980-09-19,136000.0,1,0.28,35500,False,False,False,False,False,False
app_398,"[{'category': 'Rent', 'amount': 693}, {'category': 'Dining', 'amount': 481}, {'category': 'Fitness', 'amount': 373}]",,Susan Nelson,susan.nelson67@protonmail.com,270-80-2724,172.31.197.62,Female,1969-12-10,90272,58000,92,0.14,20917,False,algorithm_risk_score,,,,,,203,Female,1969-12-10,58000.0,92,0.14,20917,False,False,False,False,False,False
app_321,"[{'category': 'Fitness', 'amount': 61}]",,Susan Young,susan.young28@hotmail.com,395-66-6220,172.25.233.1,Female,11/06/1981,10081,74000,77,0.07,26411,False,algorithm_risk_score,,,,,,204,Female,1981-06-11,74000.0,77,0.07,26411,False,False,True,False,False,False
app_464,"[{'category': 'Dining', 'amount': 850}, {'category': 'Rent', 'amount': 325}]",,Christine Hill,christine.hill24@gmail.com,400-67-4126,172.21.190.120,Female,13/06/1993,90239,41000,28,0.33,22193,False,high_dti_ratio,,,,,,205,Female,1993-06-13,41000.0,28,0.33,22193,False,False,True,False,False,False
app_427,"[{'category': 'Insurance', 'amount': 890}]",,Joseph Wilson,joseph.wilson4@mail.com,508-58-9304,10.236.75.112,Male,1983-12-10,90299,117000,80,0.27,39525,True,,,5.6,34000.0,,,206,Male,1983-12-10,117000.0,80,0.27,39525,False,False,False,False,False,False
app_019,"[{'category': 'Healthcare', 'amount': 853}, {'category': 'Entertainment', 'amount': 271}]",,Joshua King,joshua.king45@gmail.com,765-10-4403,192.168.10.121,M,17/05/1983,10086,130000,78,0.18,23420,True,,,6.4,19000.0,,,207,Male,1983-05-17,130000.0,78,0.18,23420,False,False,True,False,False,False
app_126,"[{'category': 'Shopping', 'amount': 861}]",,Jerry Rodriguez,jerry.rodriguez40@protonmail.com,477-14-5888,192.168.199.162,Male,1988-08-02,10054,83000,48,0.39,33657,True,,,4.1,37000.0,,,208,Male,1988-08-02,83000.0,48,0.39,33657,False,False,False,False,False,False
app_424,"[{'category': 'Dining', 'amount': 627}]",,Kevin Campbell,kevin.campbell22@gmail.com,671-88-1195,192.168.252.141,M,12/23/1983,10020,98000,30,0.12,13780,False,algorithm_risk_score,,,,,,209,Male,1983-12-23,98000.0,30,0.12,13780,False,False,True,False,False,False
app_354,"[{'category': 'Groceries', 'amount': 734}, {'category': 'Shopping', 'amount': 425}, {'category': 'Alcohol', 'amount': 439}]",,Gregory Torres,gregory.torres94@outlook.com,365-48-6262,10.76.180.77,Male,1978-12-28,10066,89000,104,0.33,47231,True,,,4.7,44000.0,,,210,Male,1978-12-28,89000.0,104,0.33,47231,False,False,False,False,False,False
app_060,"[{'category': 'Utilities', 'amount': 141}, {'category': 'Healthcare', 'amount': 317}, {'category': 'Transportation', 'amount': 315}]",,Jacob Nguyen,jacob.nguyen66@hotmail.com,736-38-8515,192.168.170.43,Male,1998-03-25,10042,25000,11,0.07,12900,True,,,3.8,52000.0,,,211,Male,1998-03-25,25000.0,11,0.07,12900,False,False,False,False,False,False
app_340,"[{'category': 'Education', 'amount': 205}, {'category': 'Entertainment', 'amount': 842}]",,Samantha Allen,samantha.allen89@protonmail.com,334-78-8984,172.26.145.134,F,1988-12-09,90238,107000,56,0.18,45341,True,,,4.3,33000.0,,,212,Female,1988-12-09,107000.0,56,0.18,45341,False,False,False,False,False,False
app_353,"[{'category': 'Travel', 'amount': 836}]",,Lisa Jones,lisa.jones93@outlook.com,195-45-8451,10.228.14.60,Female,1996-03-26,10069,73000,26,0.24,23924,False,algorithm_risk_score,,,,,,213,Female,1996-03-26,73000.0,26,0.24,23924,False,False,False,False,False,False
app_031,"[{'category': 'Travel', 'amount': 155}, {'category': 'Insurance', 'amount': 62}, {'category': 'Fitness', 'amount': 320}]",,Frank Baker,frank.baker87@icloud.com,216-52-4471,172.28.35.177,Male,1973-05-05,90258,79000,83,0.36,17700,True,,,4.4,51000.0,,,214,Male,1973-05-05,79000.0,83,0.36,17700,False,False,False,False,False,False
app_332,"[{'category': 'Education', 'amount': 810}]",,Timothy Green,timothy.green52@hotmail.com,677-21-7073,10.114.65.83,M,1981/09/28,10025,119000,70,0.19,43950,True,,,6.3,52000.0,,,215,Male,1981-09-28,119000.0,70,0.19,43950,False,False,True,False,False,False
app_085,"[{'category': 'Fitness', 'amount': 679}, {'category': 'Entertainment', 'amount': 337}, {'category': 'Travel', 'amount': 382}]",,Barbara Brown,barbara.brown97@yahoo.com,435-96-5496,10.229.154.59,F,2000-01-12,90234,37000,5,0.15,18428,False,insufficient_credit_history,,,,,,216,Female,2000-01-12,37000.0,5,0.15,18428,False,False,False,False,False,False
app_176,"[{'category': 'Travel', 'amount': 198}, {'category': 'Healthcare', 'amount': 102}]",2024-01-15T00:00:00Z,Steven Lee,steven.lee49@mail.com,952-58-1833,192.168.177.187,Male,1989-07-26,10058,91000,60,0.22,46039,True,,,4.9,35000.0,,,217,Male,1989-07-26,91000.0,60,0.22,46039,False,False,False,False,False,False
app_381,"[{'category': 'Utilities', 'amount': 289}]",,Patricia Adams,patricia.adams53@aol.com,498-99-6200,10.248.165.138,Female,1995/01/08,90209,82000,51,0.19,32404,False,algorithm_risk_score,,,,,,218,Female,1995-08-01,82000.0,51,0.19,32404,False,False,True,False,False,False
app_471,"[{'category': 'Groceries', 'amount': 224}]",,Nicholas Lewis,nicholas.lewis84@yahoo.com,352-53-7529,10.197.113.236,M,1979/12/26,10032,80000,61,0.08,9728,True,,,2.7,50000.0,,,219,Male,1979-12-26,80000.0,61,0.08,9728,False,False,True,False,False,False
app_236,"[{'category': 'Healthcare', 'amount': 726}, {'category': 'Travel', 'amount': 574}]",,Amy Torres,amy.torres56@yahoo.com,760-35-4986,10.4.65.185,Female,2002-04-24,90296,62000,4,0.25,25550,True,,education,6.2,23000.0,,,220,Female,2002-04-24,62000.0,4,0.25,25550,False,False,False,False,False,False
app_102,"[{'category': 'Education', 'amount': 320}]",,Edward Rivera,edward.rivera86@gmail.com,747-44-8460,192.168.182.247,M,1993/12/27,90279,76000,25,0.2,20000,True,,,3.2,22000.0,,,221,Male,1993-12-27,76000.0,25,0.2,20000,False,False,True,False,False,False
app_400,"[{'category': 'Travel', 'amount': 181}]",,Mary Jackson,mary.jackson36@yahoo.com,760-50-5199,192.168.109.56,Female,2000-06-24,30034,48000,0,0.28,5953,True,,,4.7,27000.0,,,222,Female,2000-06-24,48000.0,0,0.28,5953,False,False,False,False,False,False
app_259,"[{'category': 'Healthcare', 'amount': 549}]",,Debra Harris,debra.harris54@aol.com,397-87-5682,192.168.219.135,Female,1964-02-29,90260,94000,92,0.27,54425,True,,,6.0,44000.0,,,223,Female,1964-02-29,94000.0,92,0.27,54425,False,False,False,False,False,False
app_196,"[{'category': 'Travel', 'amount': 598}, {'category': 'Education', 'amount': 533}, {'category': 'Groceries', 'amount': 821}]",2024-01-15T00:00:00Z,Rachel Hernandez,rachel.hernandez83@yahoo.com,798-57-4126,10.7.164.75,F,1995-04-17,90225,88000,19,0.26,12943,True,,,6.4,47000.0,,,224,Female,1995-04-17,88000.0,19,0.26,12943,False,False,False,False,False,False
app_387,"[{'category': 'Entertainment', 'amount': 677}, {'category': 'Dining', 'amount': 514}, {'category': 'Alcohol', 'amount': 757}]",,Kimberly Clark,kimberly.clark21@aol.com,461-84-7853,10.72.175.55,F,17/09/1986,90243,83000,46,0.41,17222,True,,,5.4,23000.0,,,225,Female,1986-09-17,83000.0,46,0.41,17222,False,False,True,False,False,False
app_250,"[{'category': 'Travel', 'amount': 430}]",,Mark Walker,mark.walker39@protonmail.com,165-64-6386,172.19.52.123,Male,04/25/1997,10048,68000,37,0.06,48618,True,,debt_consolidation,5.6,33000.0,,,226,Male,1997-04-25,68000.0,37,0.06,48618,False,False,True,False,False,False
app_225,"[{'category': 'Shopping', 'amount': 153}]",,George Clark,george.clark56@mail.com,745-55-9936,10.159.91.211,Male,2001/01/03,30017,22000,0,0.28,3918,False,algorithm_risk_score,education,,,,,227,Male,2001-03-01,22000.0,0,0.28,3918,False,False,True,False,False,False
app_067,"[{'category': 'Utilities', 'amount': 186}]",,Scott Wilson,scott.wilson54@gmail.com,760-63-1612,192.168.141.24,Male,1997-05-07,10031,39000,36,0.37,10486,True,,,4.3,56000.0,,,228,Male,1997-05-07,39000.0,36,0.37,10486,False,False,False,False,False,False
app_337,"[{'category': 'Groceries', 'amount': 312}]",,Michelle Garcia,michelle.garcia72@protonmail.com,884-71-2102,10.253.246.138,Female,07/26/1993,90237,100000,60,0.41,56840,True,,,5.7,45000.0,,,229,Female,1993-07-26,100000.0,60,0.41,56840,False,False,True,False,False,False
app_081,"[{'category': 'Rent', 'amount': 519}]",,Kimberly Rodriguez,kimberly.rodriguez29@hotmail.com,560-36-1890,192.168.181.17,Female,1993/06/16,10053,41000,8,0.32,13208,False,high_dti_ratio,,,,,,230,Female,1993-06-16,41000.0,8,0.32,13208,False,False,True,False,False,False
app_434,"[{'category': 'Shopping', 'amount': 644}]",,Edward Flores,edward.flores2@icloud.com,565-99-4837,192.168.194.45,Male,1999-10-08,10050,35000,0,0.27,14397,False,algorithm_risk_score,,,,,,231,Male,1999-10-08,35000.0,0,0.27,14397,False,False,False,False,False,False
app_397,"[{'category': 'Transportation', 'amount': 133}, {'category': 'Rent', 'amount': 597}]",,Kimberly Jackson,kimberly.jackson7@aol.com,490-86-7662,172.27.220.170,Female,1980/12/21,90295,133000,113,0.35,39164,True,,,3.0,63000.0,,,232,Female,1980-12-21,133000.0,113,0.35,39164,False,False,True,False,False,False
app_050,"[{'category': 'Dining', 'amount': 259}, {'category': 'Travel', 'amount': 260}]",,Amanda Brown,amanda.brown92@yahoo.com,695-46-5371,172.30.31.249,Female,1994-05-06,90267,30000,49,0.06,9588,True,,,2.5,48000.0,,,233,Female,1994-05-06,30000.0,49,0.06,9588,False,False,False,False,False,False
app_220,"[{'category': 'Shopping', 'amount': 484}]",,Anthony Johnson,anthony.johnson10@yahoo.com,795-39-2227,192.168.31.81,Male,1987-11-21,10034,121000,48,0.17,18326,False,algorithm_risk_score,education,,,,,234,Male,1987-11-21,121000.0,48,0.17,18326,False,False,False,False,False,False
app_171,"[{'category': 'Dining', 'amount': 461}]",2024-01-15T00:00:00Z,Amy Rivera,amy.rivera53@mail.com,361-95-9120,172.19.104.23,Female,08/05/1996,90252,104000,47,0.32,16227,True,,,6.2,78000.0,,,235,Female,1996-05-08,104000.0,47,0.32,16227,False,False,True,False,False,False
app_017,"[{'category': 'Entertainment', 'amount': 715}, {'category': 'Transportation', 'amount': 156}, {'category': 'Gambling', 'amount': 125}]",,Nicole Allen,nicole.allen46@outlook.com,974-39-2580,192.168.15.187,Female,1995-02-11,90282,109000,60,0.15,40059,True,,,6.1,55000.0,,,236,Female,1995-02-11,109000.0,60,0.15,40059,False,False,False,False,False,False
app_304,"[{'category': 'Utilities', 'amount': 62}]",,Pamela Nelson,pamela.nelson7@aol.com,117-67-6540,10.224.21.213,Female,1981-08-06,90208,106000,69,0.2,51392,False,algorithm_risk_score,,,,,,237,Female,1981-08-06,106000.0,69,0.2,51392,False,False,False,False,False,False
app_462,"[{'category': 'Healthcare', 'amount': 599}, {'category': 'Travel', 'amount': 773}]",,Debra Gonzalez,debra.gonzalez91@protonmail.com,364-67-3550,172.31.18.200,F,17/02/1966,90278,91000,78,0.18,25979,True,,,2.8,60000.0,,,238,Female,1966-02-17,91000.0,78,0.18,25979,False,False,True,False,False,False
app_103,"[{'category': 'Insurance', 'amount': 693}]",,Debra Torres,debra.torres21@yahoo.com,607-72-9550,172.30.61.68,F,1977-02-19,10085,148000,56,0.25,61857,True,,,4.3,48000.0,,,239,Female,1977-02-19,148000.0,56,0.25,61857,False,False,False,False,False,False
app_090,"[{'category': 'Travel', 'amount': 728}, {'category': 'Shopping', 'amount': 776}, {'category': 'Dining', 'amount': 106}]",,Amanda Perez,amanda.perez24@icloud.com,757-82-3322,192.168.29.216,F,1991-05-25,90297,46000,41,0.05,25176,True,,,4.4,67000.0,,,240,Female,1991-05-25,46000.0,41,0.05,25176,False,False,False,False,False,False
app_094,"[{'category': 'Healthcare', 'amount': 891}, {'category': 'Entertainment', 'amount': 332}, {'category': 'Groceries', 'amount': 671}]",,Kenneth Scott,kenneth.scott82@outlook.com,693-48-2032,10.175.210.27,M,1986-11-03,10092,111000,44,0.43,47525,True,,,4.3,28000.0,,,241,Male,1986-11-03,111000.0,44,0.43,47525,False,False,False,False,False,False
app_343,"[{'category': 'Dining', 'amount': 257}]",,Susan Moore,susan.moore71@protonmail.com,507-29-9393,192.168.113.193,Female,1979/05/02,90275,96000,26,0.18,33687,False,insufficient_credit_history,,,,,,242,Female,1979-02-05,96000.0,26,0.18,33687,False,False,True,False,False,False
app_334,"[{'category': 'Transportation', 'amount': 445}, {'category': 'Rent', 'amount': 349}]",,Raymond Martinez,raymond.martinez88@hotmail.com,251-97-3004,172.27.74.105,Male,01/12/1979,10004,83000,29,0.1,42204,True,,,4.4,57000.0,,,243,Male,1979-12-01,83000.0,29,0.1,42204,False,False,True,False,False,False
app_403,"[{'category': 'Transportation', 'amount': 291}]",,William Davis,william.davis38@yahoo.com,636-51-1389,192.168.227.127,Male,1977-01-19,10054,138000,96,0.09,55499,False,algorithm_risk_score,,,,,,244,Male,1977-01-19,138000.0,96,0.09,55499,False,False,False,False,False,False
app_447,"[{'category': 'Groceries', 'amount': 139}]",,Jerry Nguyen,jerry.nguyen71@aol.com,799-19-9143,172.23.251.177,Male,1964/02/22,10071,77000,48,0.19,28600,True,,,6.2,22000.0,,,245,Male,1964-02-22,77000.0,48,0.19,28600,False,False,True,False,False,False
app_291,"[{'category': 'Rent', 'amount': 684}]",,Dennis Rivera,dennis.rivera40@icloud.com,786-56-7935,10.35.42.14,Male,1990-05-29,10070,79000,44,0.41,19247,True,,,4.3,67000.0,,,246,Male,1990-05-29,79000.0,44,0.41,19247,False,False,False,False,False,False
app_219,"[{'category': 'Travel', 'amount': 291}, {'category': 'Groceries', 'amount': 132}]",,Shirley Davis,shirley.davis94@yahoo.com,994-53-6088,10.71.231.137,Female,05/11/1983,90225,99000,28,0.09,66409,False,insufficient_credit_history,debt_consolidation,,,,,247,Female,1983-11-05,99000.0,28,0.09,66409,False,False,True,False,False,False
app_478,"[{'category': 'Entertainment', 'amount': 624}]",,Christine Young,christine.young13@hotmail.com,558-88-5577,192.168.174.101,Female,1994-06-30,90294,74000,21,0.28,21504,True,,,2.9,52000.0,,,248,Female,1994-06-30,74000.0,21,0.28,21504,False,False,False,False,False,False
app_125,"[{'category': 'Transportation', 'amount': 385}]",,Sharon Martinez,sharon.martinez70@hotmail.com,513-27-3988,10.188.66.157,Female,1988-06-25,90203,77000,72,0.36,30414,False,algorithm_risk_score,,,,,,249,Female,1988-06-25,77000.0,72,0.36,30414,False,False,False,False,False,False
app_242,"[{'category': 'Insurance', 'amount': 435}, {'category': 'Utilities', 'amount': 742}]",,Raymond Davis,raymond.davis31@outlook.com,493-70-3412,172.26.163.12,Male,1993-01-11,90273,51000,84,0.42,28348,False,algorithm_risk_score,moving,,,,,250,Male,1993-01-11,51000.0,84,0.42,28348,False,False,False,False,False,False
app_423,"[{'category': 'Travel', 'amount': 437}, {'category': 'Insurance', 'amount': 331}]",,Charles Hill,charles.hill58@outlook.com,697-56-2746,192.168.76.175,M,1992-08-16,10026,103000,66,0.28,40301,True,,,3.6,41000.0,,,251,Male,1992-08-16,103000.0,66,0.28,40301,False,False,False,False,False,False
app_438,"[{'category': 'Travel', 'amount': 745}, {'category': 'Dining', 'amount': 136}, {'category': 'Fitness', 'amount': 612}]",,Ryan Jones,ryan.jones94@protonmail.com,585-89-1335,192.168.173.123,Male,1995-12-19,10090,38000,35,0.22,7228,False,algorithm_risk_score,,,,,,252,Male,1995-12-19,38000.0,35,0.22,7228,False,False,False,False,False,False
app_077,"[{'category': 'Transportation', 'amount': 878}]",,Deborah Campbell,deborah.campbell7@icloud.com,199-17-5138,172.19.144.24,Female,1994-01-07,90275,86000,27,0.15,41449,False,algorithm_risk_score,,,,,,253,Female,1994-01-07,86000.0,27,0.15,41449,False,False,False,False,False,False
app_194,"[{'category': 'Education', 'amount': 224}]",2024-01-15T00:00:00Z,Ashley Allen,ashley.allen44@protonmail.com,811-74-5906,10.92.26.69,Female,1992-03-16,90223,80000,3,0.09,32385,False,algorithm_risk_score,,,,,,254,Female,1992-03-16,80000.0,3,0.09,32385,False,False,False,False,False,False
app_004,"[{'category': 'Transportation', 'amount': 329}, {'category': 'Groceries', 'amount': 810}]",,Karen Nelson,karen.nelson35@outlook.com,486-50-5539,172.31.79.76,F,02/28/1995,90217,69000,9,0.41,10327,False,high_dti_ratio,,,,,,255,Female,1995-02-28,69000.0,9,0.41,10327,False,False,True,False,False,False
app_189,"[{'category': 'Groceries', 'amount': 156}, {'category': 'Utilities', 'amount': 605}]",2024-01-15T00:00:00Z,Christopher Anderson,christopher.anderson49@protonmail.com,538-69-7345,10.238.76.188,Male,1966-05-31,90255,95000,71,0.06,41414,True,,,5.5,39000.0,,,256,Male,1966-05-31,95000.0,71,0.06,41414,False,False,False,False,False,False
app_357,"[{'category': 'Education', 'amount': 889}]",,Rebecca Wright,rebecca.wright9@mail.com,293-82-3507,10.172.238.52,F,1992-09-28,30007,76000,3,0.09,33537,False,insufficient_credit_history,,,,,,257,Female,1992-09-28,76000.0,3,0.09,33537,False,False,False,False,False,False
app_281,"[{'category': 'Transportation', 'amount': 527}]",,Timothy Davis,timothy.davis7@outlook.com,971-87-5125,172.17.250.191,M,1988-09-06,10071,99000,26,0.29,39634,True,,,5.9,47000.0,,,258,Male,1988-09-06,99000.0,26,0.29,39634,False,False,False,False,False,False
app_034,"[{'category': 'Transportation', 'amount': 358}]",,Larry Williams,larry.williams47@protonmail.com,142-17-2501,172.20.137.145,Male,1985/05/15,10013,88000,53,0.36,38528,True,,,4.0,68000.0,,,259,Male,1985-05-15,88000.0,53,0.36,38528,False,False,True,False,False,False
app_451,"[{'category': 'Transportation', 'amount': 733}]",,Gary Gonzalez,gary.gonzalez21@icloud.com,237-86-8164,192.168.184.20,Male,1981-07-13,10020,101000,49,0.12,24958,True,,,3.1,40000.0,,,260,Male,1981-07-13,101000.0,49,0.12,24958,False,False,False,False,False,False
app_011,"[{'category': 'Entertainment', 'amount': 209}, {'category': 'Fitness', 'amount': 648}]",,Linda Martin,linda.martin88@hotmail.com,471-84-3299,10.244.191.172,Female,1992-12-30,90205,89000,5,0.31,24246,False,algorithm_risk_score,,,,,,261,Female,1992-12-30,89000.0,5,0.31,24246,False,False,False,False,False,False
app_469,"[{'category': 'Rent', 'amount': 320}, {'category': 'Utilities', 'amount': 353}]",,Sandra Garcia,sandra.garcia94@protonmail.com,470-66-7883,192.168.232.123,Female,1997/03/01,90218,47000,11,0.38,21972,False,algorithm_risk_score,,,,,,262,Female,1997-01-03,47000.0,11,0.38,21972,False,False,True,False,False,False
app_248,"[{'category': 'Travel', 'amount': 620}]",,Susan Clark,susan.clark76@outlook.com,759-56-5500,10.196.31.120,F,1963-12-07,90258,84000,111,0.2,41525,False,algorithm_risk_score,debt_consolidation,,,,,263,Female,1963-12-07,84000.0,111,0.2,41525,False,False,False,False,False,False
app_311,"[{'category': 'Groceries', 'amount': 716}, {'category': 'Travel', 'amount': 285}]",,Anna Jones,anna.jones21@gmail.com,439-27-7275,172.18.235.175,Female,2001-10-02,90234,85432.789123,22,0.43,11285,True,,,4.2,44000.0,,,264,Female,2001-10-02,85432.789123,22,0.43,11285,False,False,False,False,False,False
app_362,"[{'category': 'Entertainment', 'amount': 479}]",,Michelle Anderson,michelle.anderson65@gmail.com,756-79-8536,192.168.124.18,F,2000-12-24,90279,70000,18,0.1,35720,False,algorithm_risk_score,,,,,,265,Female,2000-12-24,70000.0,18,0.1,35720,False,False,False,False,False,False
app_445,"[{'category': 'Entertainment', 'amount': 862}]",,Sarah Adams,sarah.adams85@hotmail.com,325-39-8274,192.168.193.100,Female,1958-09-21,90219,86000,71,0.14,17179,True,,,3.1,79000.0,,,266,Female,1958-09-21,86000.0,71,0.14,17179,False,False,False,False,False,False
app_211,"[{'category': 'Groceries', 'amount': 136}]",,Barbara Martin,barbara.martin84@mail.com,112-31-7412,172.28.207.224,F,1988-08-19,90222,112000,75,0.08,62775,False,algorithm_risk_score,education,,,,,267,Female,1988-08-19,112000.0,75,0.08,62775,False,False,False,False,False,False
app_118,"[{'category': 'Education', 'amount': 754}, {'category': 'Travel', 'amount': 209}]",,Dorothy Perez,dorothy.perez34@gmail.com,132-21-8550,192.168.87.39,F,1959-01-01,30038,110000,87,0.34,47222,False,algorithm_risk_score,,,,,,268,Female,1959-01-01,110000.0,87,0.34,47222,False,False,False,False,False,False
app_496,"[{'category': 'Fitness', 'amount': 175}]",,Rachel Miller,rachel.miller69@protonmail.com,953-69-6408,10.194.95.93,Female,1979-11-12,90211,87000,40,0.31,23949,True,,,6.2,25000.0,,,269,Female,1979-11-12,87000.0,40,0.31,23949,False,False,False,False,False,False
app_282,"[{'category': 'Insurance', 'amount': 399}]",,Lisa Baker,lisa.baker23@mail.com,377-29-6956,192.168.209.25,Female,1978-03-07,30017,118000,66,0.07,32286,False,algorithm_risk_score,,,,,,270,Female,1978-03-07,118000.0,66,0.07,32286,False,False,False,False,False,False
app_300,"[{'category': 'Insurance', 'amount': 798}, {'category': 'Travel', 'amount': 401}]",,Ashley Scott,ashley.scott88@mail.com,638-10-7462,192.168.4.136,Female,11/06/1990,10094,75000,0,0.39,40180,True,,,3.5,36000.0,,,271,Female,1990-06-11,75000.0,0,0.39,40180,False,False,True,False,False,False
app_253,"[{'category': 'Dining', 'amount': 223}]",,Barbara Allen,barbara.allen1@mail.com,497-28-5851,172.30.65.21,Female,1970-08-11,90241,93000,91,0.29,27309,False,algorithm_risk_score,,,,,,272,Female,1970-08-11,93000.0,91,0.29,27309,False,False,False,False,False,False
app_393,"[{'category': 'Groceries', 'amount': 723}, {'category': 'Insurance', 'amount': 687}, {'category': 'Dining', 'amount': 651}]",,Brandon Clark,brandon.clark68@mail.com,644-43-8722,172.27.210.50,Male,08/08/1997,10048,58000,21,0.14,10886,False,insufficient_credit_history,,,,,,273,Male,1997-08-08,58000.0,21,0.14,10886,False,False,True,False,False,False
app_292,"[{'category': 'Groceries', 'amount': 529}]",,Paul Rivera,paul.rivera53@hotmail.com,220-19-6890,10.5.165.220,Male,23/03/1984,10002,105000,125,0.24,63682,True,,,5.5,53000.0,,,274,Male,1984-03-23,105000.0,125,0.24,63682,False,False,True,False,False,False
app_120,"[{'category': 'Utilities', 'amount': 808}, {'category': 'Dining', 'amount': 590}]",,Carolyn Martin,,,,Female,,90240,103000,96,0.45,26517,False,algorithm_risk_score,,,,,,275,Female,,103000.0,96,0.45,26517,False,False,False,False,False,False
app_068,"[{'category': 'Healthcare', 'amount': 577}, {'category': 'Utilities', 'amount': 188}]",,Emily Lopez,john.doe@invalid,641-36-7605,172.19.231.218,Female,1993-09-05,90282,75000,30,0.31,40791,True,,,4.9,20000.0,,,276,Female,1993-09-05,75000.0,30,0.31,40791,False,True,False,False,False,False
app_157,"[{'category': 'Shopping', 'amount': 387}, {'category': 'Gambling', 'amount': 646}]",2024-01-15T00:00:00Z,Brenda Brown,brenda.brown63@gmail.com,237-95-4979,192.168.249.111,F,30/12/1982,10015,110000,34,0.11,38281,True,,,5.9,51000.0,,,277,Female,1982-12-30,110000.0,34,0.11,38281,False,False,True,False,False,False
app_158,"[{'category': 'Healthcare', 'amount': 681}, {'category': 'Entertainment', 'amount': 760}, {'category': 'Rent', 'amount': 825}]",2024-01-15T00:00:00Z,Maria Harris,maria.harris38@outlook.com,456-33-1025,172.29.126.102,Female,1994-12-08,90286,74000,31,0.38,27666,False,algorithm_risk_score,,,,,,278,Female,1994-12-08,74000.0,31,0.38,27666,False,False,False,False,False,False
app_409,"[{'category': 'Healthcare', 'amount': 292}, {'category': 'Utilities', 'amount': 285}]",,Jennifer Anderson,jennifer.anderson21@icloud.com,841-30-7960,192.168.11.106,Female,1988-03-18,90292,100000,70,0.18,15473,True,,,2.8,20000.0,,,279,Female,1988-03-18,100000.0,70,0.18,15473,False,False,False,False,False,False
app_150,"[{'category': 'Education', 'amount': 858}]",2024-01-15T00:00:00Z,Barbara Smith,barbara.smith46@aol.com,740-83-3254,172.19.176.111,Female,10/08/1980,90208,106000,49,0.25,38059,True,,,3.0,38000.0,,,280,Female,1980-08-10,106000.0,49,0.25,38059,False,False,True,False,False,False
app_213,"[{'category': 'Education', 'amount': 522}]",,Matthew Sanchez,matthew.sanchez19@gmail.com,159-79-2670,172.22.75.182,Male,1999-09-23,10071,54000,31,0.13,17081,True,,wedding,5.1,56000.0,,,281,Male,1999-09-23,54000.0,31,0.13,17081,False,False,False,False,False,False
app_361,"[{'category': 'Transportation', 'amount': 753}]",,Steven Harris,steven.harris82@yahoo.com,243-47-6228,172.29.158.152,Male,1985-10-03,10013,140000,19,0.2,54813,False,algorithm_risk_score,,,,,,282,Male,1985-10-03,140000.0,19,0.2,54813,False,False,False,False,False,False
app_040,"[{'category': 'Entertainment', 'amount': 499}]",,Samuel Carter,samuel.carter11@yahoo.com,692-44-9305,172.23.184.53,Male,1983-05-05,10015,90000,51,0.19,28995,False,algorithm_risk_score,,,,,,283,Male,1983-05-05,90000.0,51,0.19,28995,False,False,False,False,False,False
app_003,"[{'category': 'Healthcare', 'amount': 450}]",,Lisa Gonzalez,lisa.gonzalez51@yahoo.com,833-33-5929,172.21.35.195,Female,1982-08-24,90213,65000,74,0.43,7090,True,,,3.4,76000.0,,,284,Female,1982-08-24,65000.0,74,0.43,7090,False,False,False,False,False,False
app_433,"[{'category': 'Entertainment', 'amount': 530}]",,Karen Johnson,karen.johnson38@gmail.com,112-79-4713,10.114.154.164,F,15/09/1991,10010,67000,28,0.14,26113,True,,,4.4,78000.0,,,285,Female,1991-09-15,67000.0,28,0.14,26113,False,False,True,False,False,False
app_301,"[{'category': 'Education', 'amount': 115}, {'category': 'Travel', 'amount': 356}, {'category': 'Shopping', 'amount': 537}]",,Susan Baker,susan.baker33@protonmail.com,462-23-1465,10.59.198.228,Female,1981-03-18,90226,65000,50,0.1,28502,False,algorithm_risk_score,,,,,,286,Female,1981-03-18,65000.0,50,0.1,28502,False,False,False,False,False,False
app_153,"[{'category': 'Insurance', 'amount': 377}]",2024-01-15T00:00:00Z,Rachel Anderson,rachel.anderson41@aol.com,156-84-7704,192.168.15.193,Female,1979/01/24,90222,76000,56,0.36,11446,True,,,6.4,33000.0,,,287,Female,1979-01-24,76000.0,56,0.36,11446,False,False,True,False,False,False
app_363,"[{'category': 'Healthcare', 'amount': 653}]",,Patrick Allen,patrick.allen34@outlook.com,213-45-1895,10.86.16.115,Male,1961-07-23,10039,86000,74,0.11,28378,True,,,6.2,37000.0,,,288,Male,1961-07-23,86000.0,74,0.11,28378,False,False,False,False,False,False
app_459,"[{'category': 'Insurance', 'amount': 237}]",,Scott Hall,scott.hall36@protonmail.com,322-10-9593,172.21.73.194,Male,25/05/1962,10004,114000,99,0.22,47221,True,,,4.5,52000.0,,,289,Male,1962-05-25,114000.0,99,0.22,47221,False,False,True,False,False,False
app_265,"[{'category': 'Healthcare', 'amount': 491}]",,Samuel Harris,samuel.harris82@mail.com,684-68-7381,10.168.180.97,Male,1964-01-10,10044,57000,67,0.14,12651,False,algorithm_risk_score,,,,,,290,Male,1964-01-10,57000.0,67,0.14,12651,False,False,False,False,False,False
app_243,"[{'category': 'Education', 'amount': 89}]",,Kimberly Taylor,kimberly.taylor23@yahoo.com,154-17-2958,10.147.50.59,Female,1981-12-25,90293,113000,34,0.15,36980,False,algorithm_risk_score,medical,,,,,291,Female,1981-12-25,113000.0,34,0.15,36980,False,False,False,False,False,False
app_399,"[{'category': 'Groceries', 'amount': 630}]",,Dorothy Johnson,dorothy.johnson63@protonmail.com,846-62-4839,172.28.231.164,Female,1983-09-17,10083,112000,116,0.31,34612,True,,,4.5,50000.0,,,292,Female,1983-09-17,112000.0,116,0.31,34612,False,False,False,False,False,False
app_326,"[{'category': 'Utilities', 'amount': 872}, {'category': 'Transportation', 'amount': 819}, {'category': 'Groceries', 'amount': 584}]",,Jack Wilson,jack.wilson33@outlook.com,614-96-3065,172.23.51.88,Male,1985-06-28,10075,42000,2,0.4,12444,True,,,3.7,47000.0,,,293,Male,1985-06-28,42000.0,2,0.4,12444,False,False,False,False,False,False
app_047,"[{'category': 'Fitness', 'amount': 147}]",,Katherine Lopez,katherine.lopez10@mail.com,241-14-6672,192.168.202.60,Female,1987-08-11,90280,101000,0,0.16,39861,True,,,5.6,32000.0,,,294,Female,1987-08-11,101000.0,0,0.16,39861,False,False,False,False,False,False
app_155,"[{'category': 'Insurance', 'amount': 551}]",2024-01-15T00:00:00Z,Anthony Sanchez,anthony.sanchez56@protonmail.com,842-52-1461,10.29.9.21,Male,1977-05-03,90206,100000,102,0.05,44295,True,,,4.2,61000.0,,,295,Male,1977-05-03,100000.0,102,0.05,44295,False,False,False,False,False,False
app_467,"[{'category': 'Healthcare', 'amount': 655}, {'category': 'Fitness', 'amount': 159}, {'category': 'Transportation', 'amount': 663}]",,Katherine Scott,katherine.scott80@yahoo.com,570-62-1571,172.18.240.4,F,1960-08-20,90204,75000,120,0.18,35398,True,,,5.1,78000.0,,,296,Female,1960-08-20,75000.0,120,0.18,35398,False,False,False,False,False,False
app_268,"[{'category': 'Utilities', 'amount': 267}, {'category': 'Gambling', 'amount': 751}]",,Larry Williams,,,,,1971-05-14,10005,112000,102,0.07,54823,True,,,3.4,41000.0,,,297,Unknown,1971-05-14,112000.0,102,0.07,54823,False,False,False,False,False,False
app_377,"[{'category': 'Utilities', 'amount': 566}]",,Anna White,,617-17-3415,192.168.111.167,Female,1990-09-26,90237,116000,9,0.19,48943,True,,,4.5,40000.0,,,298,Female,1990-09-26,116000.0,9,0.19,48943,False,False,False,False,False,False
app_331,"[{'category': 'Entertainment', 'amount': 531}]",,Eric Garcia,eric.garcia25@aol.com,402-58-5593,10.249.192.226,Male,1974-04-06,10083,88000,64,0.29,27261,False,algorithm_risk_score,,,,,,299,Male,1974-04-06,88000.0,64,0.29,27261,False,False,False,False,False,False
app_231,"[{'category': 'Fitness', 'amount': 572}]",,Jerry Nguyen,jerry.nguyen45@yahoo.com,821-93-7079,172.28.235.138,M,1994-12-28,10074,78000,40,0.33,31025,True,,moving,6.0,62000.0,,,300,Male,1994-12-28,78000.0,40,0.33,31025,False,False,False,False,False,False
app_206,"[{'category': 'Education', 'amount': 523}]",,Eric Lopez,eric.lopez71@hotmail.com,777-10-2991,172.31.144.149,Male,1963/01/29,10003,72000,44,0.19,15112,False,algorithm_risk_score,wedding,,,,,301,Male,1963-01-29,72000.0,44,0.19,15112,False,False,True,False,False,False
app_499,"[{'category': 'Groceries', 'amount': 810}]",,Deborah Lee,deborah.lee74@mail.com,843-60-2218,10.1.111.83,Female,1983-12-02,90218,111000,3,0.19,78838,True,,,4.1,62000.0,,,302,Female,1983-12-02,111000.0,3,0.19,78838,False,False,False,False,False,False
app_284,"[{'category': 'Insurance', 'amount': 174}]",,Jennifer Wilson,jennifer.wilson74@aol.com,706-77-6780,10.66.16.52,F,1996/03/13,90276,56000,14,0.08,17759,True,,,2.7,52000.0,,,303,Female,1996-03-13,56000.0,14,0.08,17759,False,False,True,False,False,False
app_358,"[{'category': 'Entertainment', 'amount': 380}]",,Robert White,robert.white40@yahoo.com,828-21-4537,10.199.204.216,Male,1991/02/04,10060,70000,47,0.35,6989,True,,,3.5,80000.0,,,304,Male,1991-04-02,70000.0,47,0.35,6989,False,False,True,False,False,False
app_175,"[{'category': 'Education', 'amount': 290}, {'category': 'Utilities', 'amount': 630}]",2024-01-15T00:00:00Z,Raymond Williams,raymond.williams54@yahoo.com,178-62-8743,192.168.49.174,Male,04/09/1992,10012,46000,47,0.31,19411,True,,,3.8,51000.0,,,305,Male,1992-09-04,46000.0,47,0.31,19411,False,False,True,False,False,False
app_389,"[{'category': 'Transportation', 'amount': 337}]",,Kevin Allen,kevin.allen67@icloud.com,769-78-5087,192.168.162.66,Male,2001-04-30,10001,51000,12,0.33,17638,True,,,4.6,70000.0,,,306,Male,2001-04-30,51000.0,12,0.33,17638,False,False,False,False,False,False
app_302,"[{'category': 'Travel', 'amount': 693}, {'category': 'Education', 'amount': 726}]",,James Martin,james.martin52@gmail.com,594-58-9666,10.42.101.217,M,2000-03-23,10016,60000,53,0.29,27973,True,,,3.0,21000.0,,,307,Male,2000-03-23,60000.0,53,0.29,27973,False,False,False,False,False,False
app_443,"[{'category': 'Education', 'amount': 239}, {'category': 'Insurance', 'amount': 177}, {'category': 'Groceries', 'amount': 806}]",,Scott Gonzalez,scott.gonzalez70@hotmail.com,440-21-5768,172.31.192.181,M,1975-11-23,10040,101000,67,0.43,27879,True,,,5.5,31000.0,,,308,Male,1975-11-23,101000.0,67,0.43,27879,False,False,False,False,False,False
app_217,"[{'category': 'Healthcare', 'amount': 147}, {'category': 'Dining', 'amount': 633}]",,Paul Hernandez,paul.hernandez12@yahoo.com,320-37-6522,172.21.89.24,Male,1986-12-22,10079,91000,56,0.23,47092,False,algorithm_risk_score,auto,,,,,309,Male,1986-12-22,91000.0,56,0.23,47092,False,False,False,False,False,False
app_380,"[{'category': 'Fitness', 'amount': 521}, {'category': 'Alcohol', 'amount': 447}]",,Debra Anderson,debra.anderson61@outlook.com,309-91-9124,10.200.165.163,Female,01/07/1969,90294,86000,48,0.08,26763,True,,,5.7,19000.0,,,310,Female,1969-07-01,86000.0,48,0.08,26763,False,False,True,False,False,False
app_425,"[{'category': 'Dining', 'amount': 148}]",,Gary Carter,gary.carter31@aol.com,102-67-7969,172.16.43.205,M,1986-04-15,10095,144000,37,0.31,48632,True,,,5.7,59000.0,,,311,Male,1986-04-15,144000.0,37,0.31,48632,False,False,False,False,False,False
app_450,"[{'category': 'Dining', 'amount': 742}]",,Betty Walker,betty.walker73@mail.com,664-30-6164,10.36.80.238,F,18/03/1988,90227,89000,67,0.29,27374,False,algorithm_risk_score,,,,,,312,Female,1988-03-18,89000.0,67,0.29,27374,False,False,True,False,False,False
app_181,"[{'category': 'Travel', 'amount': 67}]",2024-01-15T00:00:00Z,Rachel Carter,rachel.carter45@yahoo.com,750-28-6195,10.245.209.184,Female,04/13/1996,90284,89000,79,0.44,36769,True,,,5.0,54000.0,,,313,Female,1996-04-13,89000.0,79,0.44,36769,False,False,True,False,False,False
app_082,"[{'category': 'Transportation', 'amount': 108}, {'category': 'Utilities', 'amount': 819}]",,Pamela Harris,pamela.harris94@yahoo.com,980-68-5455,192.168.26.10,Female,1997-09-29,10096,52000,62,0.22,13436,True,,,3.2,27000.0,,,314,Female,1997-09-29,52000.0,62,0.22,13436,False,False,False,False,False,False
app_308,"[{'category': 'Utilities', 'amount': 169}, {'category': 'Rent', 'amount': 514}, {'category': 'Transportation', 'amount': 873}]",,Gregory Hernandez,gregory.hernandez16@yahoo.com,173-77-8335,192.168.209.8,Male,1986-04-27,10004,100000,37,0.33,44154,True,,,5.2,76000.0,,,315,Male,1986-04-27,100000.0,37,0.33,44154,False,False,False,False,False,False
app_402,"[{'category': 'Education', 'amount': 482}]",,Heather Flores,heather.flores23@mail.com,100-58-8097,172.21.176.42,Female,1965-03-07,90214,88000,27,1.85,37281,True,,,3.2,17000.0,,,316,Female,1965-03-07,88000.0,27,1.85,37281,False,False,False,False,True,False
app_333,"[{'category': 'Healthcare', 'amount': 83}]",,Brenda Rivera,brenda.rivera75@mail.com,531-44-6342,172.20.119.239,Female,1982-02-01,90254,85000,48,0.19,20643,True,,,5.3,73000.0,,,317,Female,1982-02-01,85000.0,48,0.19,20643,False,False,False,False,False,False
app_116,"[{'category': 'Fitness', 'amount': 301}, {'category': 'Transportation', 'amount': 439}]",,Emily Harris,emily.harris96@hotmail.com,671-84-8245,172.29.175.6,Female,14/08/1993,90224,102000,38,0.09,41035,False,algorithm_risk_score,,,,,,318,Female,1993-08-14,102000.0,38,0.09,41035,False,False,True,False,False,False
app_417,"[{'category': 'Travel', 'amount': 739}, {'category': 'Healthcare', 'amount': 765}]",,Patrick Green,patrick.green57@aol.com,852-28-8582,172.26.226.117,Male,1980-04-10,10072,63000,44,0.22,25271,True,,,4.7,48000.0,,,319,Male,1980-04-10,63000.0,44,0.22,25271,False,False,False,False,False,False
app_316,"[{'category': 'Entertainment', 'amount': 774}, {'category': 'Travel', 'amount': 642}]",,Paul Brown,paul.brown98@aol.com,413-70-1353,172.17.253.4,Male,1989-02-07,10003,74000,16,0.3,25959,False,insufficient_credit_history,,,,,,320,Male,1989-02-07,74000.0,16,0.3,25959,False,False,False,False,False,False
app_385,"[{'category': 'Shopping', 'amount': 98}, {'category': 'Entertainment', 'amount': 181}]",,Sharon Thomas,sharon.thomas34@mail.com,229-81-3457,172.31.31.1,F,1979-12-24,90210,86000,44,0.39,27401,True,,,5.0,76000.0,,,321,Female,1979-12-24,86000.0,44,0.39,27401,False,False,False,False,False,False
app_318,"[{'category': 'Fitness', 'amount': 599}, {'category': 'Entertainment', 'amount': 269}]",,Emma Thompson,emma.thompson42@gmail.com,839-40-5735,172.24.220.183,Female,1987-04-26,10011,68000,40,0.08,21717,False,algorithm_risk_score,,,,,,322,Female,1987-04-26,68000.0,40,0.08,21717,False,False,False,False,False,False
app_485,"[{'category': 'Education', 'amount': 765}, {'category': 'Entertainment', 'amount': 164}]",,Margaret Taylor,margaret.taylor92@protonmail.com,741-12-7717,10.216.187.15,Female,24/10/1988,90256,108000,74,0.37,57352,True,,,3.7,72000.0,,,323,Female,1988-10-24,108000.0,74,0.37,57352,False,False,True,False,False,False
app_235,"[{'category': 'Travel', 'amount': 886}]",,Donald Hill,donald.hill14@gmail.com,739-31-6047,192.168.244.146,Male,1997/08/31,10012,22000,16,0.28,12134,True,,medical,5.4,39000.0,,,324,Male,1997-08-31,22000.0,16,0.28,12134,False,False,True,False,False,False
app_375,"[{'category': 'Travel', 'amount': 418}]",,Karen Brown,karen.brown39@aol.com,579-21-2895,192.168.221.138,Female,08/05/1984,90279,120000,64,0.37,50611,True,,,5.9,17000.0,,,325,Female,1984-05-08,120000.0,64,0.37,50611,False,False,True,False,False,False
app_455,"[{'category': 'Insurance', 'amount': 508}, {'category': 'Fitness', 'amount': 863}]",,Anthony Wilson,anthony.wilson95@gmail.com,564-81-2410,192.168.136.24,M,1981-02-13,10020,92000,64,0.12,29125,True,,,5.1,59000.0,,,326,Male,1981-02-13,92000.0,64,0.12,29125,False,False,False,False,False,False
app_207,"[{'category': 'Insurance', 'amount': 866}, {'category': 'Travel', 'amount': 837}, {'category': 'Gambling', 'amount': 679}]",,Betty White,betty.white53@gmail.com,633-70-2315,10.102.66.189,Female,06/20/2000,90201,62000,17,0.32,29372,False,algorithm_risk_score,vacation,,,,,327,Female,2000-06-20,62000.0,17,0.32,29372,False,False,True,False,False,False
app_006,"[{'category': 'Shopping', 'amount': 121}, {'category': 'Insurance', 'amount': 570}]",,Scott Wright,scott.wright39@outlook.com,158-53-3545,172.26.92.152,Male,1987-07-12,10048,82000,24,0.21,0,True,,,6.2,27000.0,,,328,Male,1987-07-12,82000.0,24,0.21,0,False,False,False,False,False,False
app_339,"[{'category': 'Transportation', 'amount': 91}, {'category': 'Fitness', 'amount': 641}]",,Patricia Lopez,patricia.lopez90@icloud.com,187-21-4050,192.168.183.52,Female,1984/12/27,10081,107000,25,0.23,36367,True,,,4.8,15000.0,,,329,Female,1984-12-27,107000.0,25,0.23,36367,False,False,True,False,False,False
app_183,"[{'category': 'Healthcare', 'amount': 838}]",2024-01-15T00:00:00Z,Patrick Lewis,patrick.lewis88@outlook.com,956-25-2870,192.168.39.77,Male,09/20/1998,10003,36000,12,0.17,1661,True,,,4.9,16000.0,,,330,Male,1998-09-20,36000.0,12,0.17,1661,False,False,True,False,False,False
app_096,"[{'category': 'Utilities', 'amount': 298}]",,Nicholas Roberts,nicholas.roberts5@protonmail.com,789-45-9885,10.185.208.12,M,1995-05-16,10014,84000,8,0.3,41724,False,algorithm_risk_score,,,,,,331,Male,1995-05-16,84000.0,8,0.3,41724,False,False,False,False,False,False
app_237,"[{'category': 'Fitness', 'amount': 235}, {'category': 'Education', 'amount': 877}]",,Nicholas Miller,nicholas.miller59@mail.com,266-19-6931,172.25.56.120,M,1995-05-14,10033,61000,30,0.33,20775,False,algorithm_risk_score,business,,,,,332,Male,1995-05-14,61000.0,30,0.33,20775,False,False,False,False,False,False
app_298,"[{'category': 'Groceries', 'amount': 825}, {'category': 'Shopping', 'amount': 298}]",,Eric Perez,eric.perez81@hotmail.com,610-35-3744,172.16.112.87,Male,1962-04-27,10089,94000,129,0.4,44612,True,,,3.5,57000.0,,,333,Male,1962-04-27,94000.0,129,0.4,44612,False,False,False,False,False,False
app_026,"[{'category': 'Travel', 'amount': 634}, {'category': 'Dining', 'amount': 260}, {'category': 'Groceries', 'amount': 220}]",,Pamela Perez,pamela.perez96@outlook.com,512-39-4116,10.68.90.51,F,1981-06-14,90229,72000,69,0.31,34051,True,,,3.2,20000.0,,,334,Female,1981-06-14,72000.0,69,0.31,34051,False,False,False,False,False,False
app_383,"[{'category': 'Shopping', 'amount': 452}]",,Richard Carter,richard.carter61@protonmail.com,893-66-4336,10.214.83.104,Male,1992-09-01,10058,62000,0,0.38,23113,True,,,4.9,43000.0,,,335,Male,1992-09-01,62000.0,0,0.38,23113,False,False,False,False,False,False
app_131,"[{'category': 'Entertainment', 'amount': 878}, {'category': 'Rent', 'amount': 233}]",,Janet Johnson,janet.johnson91@gmail.com,605-97-2230,10.245.40.15,F,1960-01-02,90286,85000,127,0.09,14930,True,,,5.8,32000.0,,,336,Female,1960-01-02,85000.0,127,0.09,14930,False,False,False,False,False,False
app_440,"[{'category': 'Utilities', 'amount': 562}]",,Frank Young,frank.young21@mail.com,979-12-4442,172.20.230.209,Male,1990-01-01,10009,74000,80,0.28,25925,True,,,5.3,73000.0,,,337,Male,1990-01-01,74000.0,80,0.28,25925,False,False,False,False,False,False
app_138,"[{'category': 'Insurance', 'amount': 371}, {'category': 'Entertainment', 'amount': 305}, {'category': 'Adult Entertainment', 'amount': 848}]",,Kevin Lopez,kevin.lopez85@protonmail.com,672-64-7149,192.168.36.21,Male,1963-08-01,10036,64000,56,0.24,26880,False,algorithm_risk_score,,,,,,338,Male,1963-08-01,64000.0,56,0.24,26880,False,False,False,False,False,False
app_002,"[{'category': 'Education', 'amount': 533}]",,Kevin Roberts,kevin.roberts9@protonmail.com,992-61-4010,172.19.95.144,Male,1999-08-01,10020,41000,5,0.36,18200,False,algorithm_risk_score,,,,,,339,Male,1999-08-01,41000.0,5,0.36,18200,False,False,False,False,False,False
app_185,"[{'category': 'Utilities', 'amount': 570}, {'category': 'Travel', 'amount': 191}, {'category': 'Healthcare', 'amount': 587}]",2024-01-15T00:00:00Z,George Clark,george.clark73@aol.com,804-59-4925,10.178.229.242,Male,1984-05-10,10039,60000,65,0.34,38690,True,,,5.6,24000.0,,,340,Male,1984-05-10,60000.0,65,0.34,38690,False,False,False,False,False,False
app_267,"[{'category': 'Groceries', 'amount': 133}, {'category': 'Shopping', 'amount': 723}, {'category': 'Transportation', 'amount': 394}]",,Donald Adams,donald.adams15@mail.com,177-32-2203,10.37.119.151,Male,1976-01-24,10056,82000,65,0.19,40258,True,,,6.0,63000.0,,,341,Male,1976-01-24,82000.0,65,0.19,40258,False,False,False,False,False,False
app_112,"[{'category': 'Dining', 'amount': 841}, {'category': 'Transportation', 'amount': 564}]",,Cynthia Rodriguez,cynthia.rodriguez5@icloud.com,323-67-4611,10.134.193.125,Female,1999-08-26,90207,56000,42,0.39,1863,True,,,3.2,57000.0,,,342,Female,1999-08-26,56000.0,42,0.39,1863,False,False,False,False,False,False
app_030,"[{'category': 'Healthcare', 'amount': 874}]",,Christopher Allen,christopher.allen95@hotmail.com,605-74-9223,172.20.144.30,Male,1989-03-12,10063,72000,30,0.37,28898,False,insufficient_credit_history,,,,,,343,Male,1989-03-12,72000.0,30,0.37,28898,False,False,False,False,False,False
app_018,"[{'category': 'Rent', 'amount': 723}, {'category': 'Shopping', 'amount': 167}]",,Patrick Martinez,patrick.martinez51@hotmail.com,935-32-9047,192.168.65.254,Male,1991-12-23,10096,64000,18,0.2,11567,False,algorithm_risk_score,,,,,,344,Male,1991-12-23,64000.0,18,0.2,11567,False,False,False,False,False,False
app_239,"[{'category': 'Fitness', 'amount': 159}]",,Pamela Jackson,pamela.jackson33@gmail.com,501-16-9057,10.66.71.252,F,12/13/1970,90260,58000,118,0.25,10333,False,algorithm_risk_score,moving,,,,,345,Female,1970-12-13,58000.0,118,0.25,10333,False,False,True,False,False,False
app_053,"[{'category': 'Insurance', 'amount': 538}]",,Richard Sanchez,richard.sanchez9@hotmail.com,309-94-6280,192.168.186.248,Male,1986/11/29,10041,101000,48,0.17,52330,True,,,5.8,74000.0,,,346,Male,1986-11-29,101000.0,48,0.17,52330,False,False,True,False,False,False
app_341,"[{'category': 'Fitness', 'amount': 363}]",,Cynthia Anderson,cynthia.anderson96@gmail.com,871-61-4185,172.22.214.211,Female,1991-05-13,10035,63000,50,0.21,15639,False,algorithm_risk_score,,,,,,347,Female,1991-05-13,63000.0,50,0.21,15639,False,False,False,False,False,False
app_142,"[{'category': 'Groceries', 'amount': 146}]",2024-01-15T00:00:00Z,Eric Lee,eric.lee8@outlook.com,813-95-8373,172.19.216.226,Male,10/24/2001,10050,72000,66,0.34,15207,True,,,3.0,17000.0,,,348,Male,2001-10-24,72000.0,66,0.34,15207,False,False,True,False,False,False
app_035,"[{'category': 'Healthcare', 'amount': 372}, {'category': 'Education', 'amount': 711}, {'category': 'Utilities', 'amount': 473}]",,Ashley Ramirez,ashley.ramirez39@yahoo.com,300-69-5628,192.168.199.159,Female,1975-03-01,90233,81000,37,0.07,35656,True,,,5.3,40000.0,,,349,Female,1975-03-01,81000.0,37,0.07,35656,False,False,False,False,False,False
app_406,"[{'category': 'Education', 'amount': 274}]",,Thomas Jones,thomas.jones1@hotmail.com,496-11-4971,10.149.126.1,Male,1974/08/23,10099,106000,56,0.08,52422,True,,,5.4,18000.0,,,350,Male,1974-08-23,106000.0,56,0.08,52422,False,False,True,False,False,False
app_327,"[{'category': 'Fitness', 'amount': 272}, {'category': 'Dining', 'amount': 481}, {'category': 'Travel', 'amount': 601}]",,Karen Martinez,karen.martinez76@mail.com,338-35-5699,192.168.161.166,Female,1999-10-24,90261,40000,72,0.2,14626,False,algorithm_risk_score,,,,,,351,Female,1999-10-24,40000.0,72,0.2,14626,False,False,False,False,False,False
app_066,"[{'category': 'Insurance', 'amount': 531}]",,Debra Young,debra.young83@icloud.com,816-55-7955,172.16.242.146,Female,1999/09/10,90214,28000,20,0.36,11680,False,algorithm_risk_score,,,,,,352,Female,1999-10-09,28000.0,20,0.36,11680,False,False,True,False,False,False
app_414,"[{'category': 'Insurance', 'amount': 794}]",,Brandon Williams,brandon.williams88@aol.com,732-68-4558,172.19.127.70,Male,1987-09-16,10012,76000,29,0.4,36303,True,,,5.2,57000.0,,,353,Male,1987-09-16,76000.0,29,0.4,36303,False,False,False,False,False,False
app_042,"[{'category': 'Insurance', 'amount': 153}, {'category': 'Dining', 'amount': 468}]",,Joseph Lopez,joseph.lopez1@gmail.com,652-70-5530,192.168.91.142,Male,1990-05-04,10044,69000,43,0.41,15974,False,algorithm_risk_score,,,,,RESUBMISSION,354,Male,1990-05-04,69000.0,43,0.41,15974,True,False,False,False,False,False
app_374,"[{'category': 'Shopping', 'amount': 471}, {'category': 'Rent', 'amount': 666}]",,Nancy Sanchez,nancy.sanchez75@gmail.com,637-82-2711,10.207.207.221,F,1969-12-26,90294,81000,41,0.17,13259,False,algorithm_risk_score,,,,,,355,Female,1969-12-26,81000.0,41,0.17,13259,False,False,False,False,False,False
app_198,"[{'category': 'Utilities', 'amount': 366}]",2024-01-15T00:00:00Z,Robert Lee,robert.lee68@yahoo.com,306-62-4668,192.168.48.82,M,26/07/1996,10057,49000,0,0.12,21939,False,algorithm_risk_score,,,,,,356,Male,1996-07-26,49000.0,0,0.12,21939,False,False,True,False,False,False
app_182,"[{'category': 'Insurance', 'amount': 633}]",2024-01-15T00:00:00Z,Steven Roberts,steven.roberts81@outlook.com,766-23-5646,10.143.138.207,Male,1982-11-17,10096,102000,53,0.39,39743,True,,,2.9,40000.0,,,357,Male,1982-11-17,102000.0,53,0.39,39743,False,False,False,False,False,False
app_315,"[{'category': 'Travel', 'amount': 760}]",,Matthew Campbell,matthew.campbell38@hotmail.com,384-63-3991,172.30.8.110,Male,1977/07/31,10027,81000,47,0.23,30944,False,algorithm_risk_score,,,,,,358,Male,1977-07-31,81000.0,47,0.23,30944,False,False,True,False,False,False
app_161,"[{'category': 'Dining', 'amount': 155}]",2024-01-15T00:00:00Z,James Hernandez,james.hernandez26@gmail.com,279-33-8125,192.168.114.31,Male,2001-04-06,10067,40000,16,0.07,21612,False,algorithm_risk_score,,,,,,359,Male,2001-04-06,40000.0,16,0.07,21612,False,False,False,False,False,False
app_328,"[{'category': 'Fitness', 'amount': 219}, {'category': 'Insurance', 'amount': 336}, {'category': 'Healthcare', 'amount': 178}]",,Raymond Nguyen,raymond.nguyen73@mail.com,759-78-1197,172.18.33.215,Male,1982-06-07,10076,93000,28,0.12,35502,True,,,3.7,66000.0,,,360,Male,1982-06-07,93000.0,28,0.12,35502,False,False,False,False,False,False
app_415,"[{'category': 'Education', 'amount': 764}, {'category': 'Dining', 'amount': 804}]",,Patrick Martin,patrick.martin81@hotmail.com,122-39-5106,172.20.236.220,Male,1994-01-12,10002,105000,32,0.06,37428,False,algorithm_risk_score,,,,,,361,Male,1994-01-12,105000.0,32,0.06,37428,False,False,False,False,False,False
app_199,"[{'category': 'Healthcare', 'amount': 382}, {'category': 'Rent', 'amount': 327}]",2024-01-15T00:00:00Z,Donald Garcia,donald.garcia71@hotmail.com,264-53-5742,192.168.142.118,M,1994-07-07,30008,68000,43,0.41,8346,False,algorithm_risk_score,,,,,,362,Male,1994-07-07,68000.0,43,0.41,8346,False,False,False,False,False,False
app_293,"[{'category': 'Travel', 'amount': 615}, {'category': 'Groceries', 'amount': 361}]",,Lisa Garcia,lisa.garcia37@gmail.com,200-24-4510,172.27.233.233,Female,1978-07-28,90246,102000,95,0.08,16304,True,,,3.4,46000.0,,,363,Female,1978-07-28,102000.0,95,0.08,16304,False,False,False,False,False,False
app_227,"[{'category': 'Rent', 'amount': 380}]",,Nicole Walker,nicole.walker5@outlook.com,401-38-9057,172.17.226.214,F,10/02/2002,90257,44000,26,0.22,26111,False,algorithm_risk_score,debt_consolidation,,,,,364,Female,2002-02-10,44000.0,26,0.22,26111,False,False,True,False,False,False
app_021,"[{'category': 'Healthcare', 'amount': 513}]",,Maria Rodriguez,maria.rodriguez24@protonmail.com,661-89-6961,192.168.224.244,Female,12/08/1982,90234,100000,96,0.11,29386,True,,,4.7,40000.0,,,365,Female,1982-08-12,100000.0,96,0.11,29386,False,False,True,False,False,False
app_233,"[{'category': 'Transportation', 'amount': 363}]",,Dorothy Nelson,dorothy.nelson99@mail.com,501-89-7625,172.30.238.65,F,1991-04-23,90232,70000,64,0.19,21220,True,,wedding,4.4,42000.0,,,366,Female,1991-04-23,70000.0,64,0.19,21220,False,False,False,False,False,False
app_098,"[{'category': 'Transportation', 'amount': 784}, {'category': 'Education', 'amount': 722}]",,Justin Young,justin.young47@hotmail.com,935-12-2949,172.26.124.154,M,1965-01-17,10006,92000,92,0.38,34427,False,algorithm_risk_score,,,,,,367,Male,1965-01-17,92000.0,92,0.38,34427,False,False,False,False,False,False
app_482,"[{'category': 'Education', 'amount': 646}, {'category': 'Transportation', 'amount': 152}, {'category': 'Insurance', 'amount': 172}]",,Joseph Sanchez,joseph.sanchez55@mail.com,706-13-4523,192.168.39.181,M,08/12/1975,10008,98000,61,0.33,23017,False,high_dti_ratio,,,,,,368,Male,1975-12-08,98000.0,61,0.33,23017,False,False,True,False,False,False
app_146,"[{'category': 'Education', 'amount': 687}, {'category': 'Shopping', 'amount': 73}]",2024-01-15T00:00:00Z,Amy Flores,sarah.smith@,577-59-1479,10.4.113.112,Female,1970-04-26,90262,79000,102,0.2,24961,True,,,2.7,61000.0,,,369,Female,1970-04-26,79000.0,102,0.2,24961,False,True,False,False,False,False
app_140,"[{'category': 'Travel', 'amount': 487}, {'category': 'Shopping', 'amount': 315}]",,Joseph Taylor,joseph.taylor79@mail.com,876-10-8698,172.20.105.89,M,1973-06-27,10047,45000,76,0.15,16933,False,algorithm_risk_score,,,,,,370,Male,1973-06-27,45000.0,76,0.15,16933,False,False,False,False,False,False
app_431,"[{'category': 'Travel', 'amount': 720}, {'category': 'Fitness', 'amount': 570}]",,Anna Martin,anna.martin93@mail.com,597-24-6392,10.150.224.185,Female,08/02/1960,90203,68000,129,0.4,24830,False,algorithm_risk_score,,,,,,371,Female,1960-02-08,68000.0,129,0.4,24830,False,False,True,False,False,False
app_287,"[{'category': 'Utilities', 'amount': 331}, {'category': 'Education', 'amount': 571}]",,Janet Johnson,janet.johnson88@aol.com,205-59-5076,10.46.31.230,Female,1980-09-19,90285,105000,82,0.35,31931,True,,,6.1,43000.0,,,372,Female,1980-09-19,105000.0,82,0.35,31931,False,False,False,False,False,False
app_244,"[{'category': 'Travel', 'amount': 500}]",,David Nguyen,david.nguyen10@gmail.com,821-96-5629,172.23.242.225,Male,17/03/1996,10074,79000,56,0.08,17047,True,,education,3.2,26000.0,,,373,Male,1996-03-17,79000.0,56,0.08,17047,False,False,True,False,False,False
app_113,"[{'category': 'Utilities', 'amount': 359}, {'category': 'Transportation', 'amount': 723}]",,Melissa Nelson,melissa.nelson5@mail.com,599-53-4517,10.163.154.138,Female,1997-04-18,90272,40000,45,0.22,11728,False,algorithm_risk_score,,,,,,374,Female,1997-04-18,40000.0,45,0.22,11728,False,False,False,False,False,False
app_136,"[{'category': 'Entertainment', 'amount': 554}, {'category': 'Transportation', 'amount': 726}, {'category': 'Adult Entertainment', 'amount': 710}]",,Edward Taylor,edward.taylor43@outlook.com,934-73-3533,192.168.88.82,Male,1993-12-13,10026,29000,43,0.36,9624,True,,,5.8,72000.0,,,375,Male,1993-12-13,29000.0,43,0.36,9624,False,False,False,False,False,False
app_152,"[{'category': 'Healthcare', 'amount': 893}]",2024-01-15T00:00:00Z,Alexander Rodriguez,alexander.rodriguez71@outlook.com,938-80-5542,10.167.213.23,Male,2001-07-27,10012,46000,26,0.16,21942,True,,,4.7,19000.0,,,376,Male,2001-07-27,46000.0,26,0.16,21942,False,False,False,False,False,False
app_022,"[{'category': 'Travel', 'amount': 61}, {'category': 'Utilities', 'amount': 176}]",,James Allen,james.allen60@protonmail.com,429-40-8330,192.168.34.174,Male,1972-05-15,10081,99000,94,0.09,43381,True,,,2.9,35000.0,,,377,Male,1972-05-15,99000.0,94,0.09,43381,False,False,False,False,False,False
app_048,"[{'category': 'Rent', 'amount': 584}]",,Andrew Jones,andrew.jones20@hotmail.com,488-99-5520,172.18.247.172,M,08/26/1983,10064,107000,36,0.2,30597,True,,,5.6,47000.0,,,378,Male,1983-08-26,107000.0,36,0.2,30597,False,False,True,False,False,False
app_329,"[{'category': 'Transportation', 'amount': 546}]",,Betty Martinez,betty.martinez42@mail.com,794-64-7602,172.16.109.93,F,1966-10-06,90247,55000,85,0.42,20278,False,algorithm_risk_score,,,,,,379,Female,1966-10-06,55000.0,85,0.42,20278,False,False,False,False,False,False
app_461,"[{'category': 'Entertainment', 'amount': 610}, {'category': 'Transportation', 'amount': 226}]",,Shirley Robinson,shirley.robinson11@yahoo.com,934-39-1807,192.168.85.100,F,1997-06-20,90280,46000,38,0.28,13390,False,algorithm_risk_score,,,,,,380,Female,1997-06-20,46000.0,38,0.28,13390,False,False,False,False,False,False
app_045,"[{'category': 'Dining', 'amount': 390}]",,Jennifer Thomas,jennifer.thomas38@protonmail.com,848-81-7036,172.16.244.182,F,1964-12-22,90237,76000,82,0.21,25982,False,algorithm_risk_score,,,,,,381,Female,1964-12-22,76000.0,82,0.21,25982,False,False,False,False,False,False
app_405,"[{'category': 'Groceries', 'amount': 364}, {'category': 'Transportation', 'amount': 566}, {'category': 'Shopping', 'amount': 839}]",,Stephanie Hill,stephanie.hill77@gmail.com,694-77-8788,172.26.24.219,Female,1989-09-05,90202,48000,13,0.38,964,False,high_dti_ratio,,,,,,382,Female,1989-09-05,48000.0,13,0.38,964,False,False,False,False,False,False
app_001,"[{'category': 'Fitness', 'amount': 576}]",,Stephanie Nguyen,stephanie.nguyen47@mail.com,427-90-1892,10.121.120.213,Female,1986-05-27,90230,102000,37,0.42,0,False,high_dti_ratio,,,,,,383,Female,1986-05-27,102000.0,37,0.42,0,True,False,False,False,False,False
app_089,"[{'category': 'Education', 'amount': 511}, {'category': 'Insurance', 'amount': 689}]",,Janet Wright,janet.wright48@gmail.com,988-25-1177,10.12.86.45,F,02/10/1979,90251,93000,98,0.22,23117,True,,,5.5,53000.0,,,384,Female,1979-10-02,93000.0,98,0.22,23117,False,False,True,False,False,False
app_197,"[{'category': 'Fitness', 'amount': 368}, {'category': 'Healthcare', 'amount': 136}]",2024-01-15T00:00:00Z,Amanda Brown,amanda.brown31@icloud.com,885-43-6142,192.168.85.229,Female,1970/04/15,90284,80000,83,0.21,37307,False,algorithm_risk_score,,,,,,385,Female,1970-04-15,80000.0,83,0.21,37307,False,False,True,False,False,False
app_368,"[{'category': 'Travel', 'amount': 521}]",,Robert Hall,robert.hall89@mail.com,262-36-4877,10.81.51.193,Male,1996-08-27,10045,29000,0,0.22,5045,False,algorithm_risk_score,,,,,,386,Male,1996-08-27,29000.0,0,0.22,5045,False,False,False,False,False,False
app_378,"[{'category': 'Shopping', 'amount': 523}]",,Jeffrey Baker,jeffrey.baker68@aol.com,868-86-8190,10.161.120.154,Male,1968-04-04,10034,131000,48,0.18,63712,True,,,4.3,56000.0,,,387,Male,1968-04-04,131000.0,48,0.18,63712,False,False,False,False,False,False
app_325,"[{'category': 'Rent', 'amount': 191}]",,Lisa Nguyen,lisa.nguyen45@protonmail.com,217-40-8640,192.168.54.67,Female,01/11/1981,10043,79000,63,0.39,27810,False,algorithm_risk_score,,,,,,388,Female,1981-11-01,79000.0,63,0.39,27810,False,False,True,False,False,False
app_041,"[{'category': 'Travel', 'amount': 172}, {'category': 'Dining', 'amount': 419}]",,Linda Rodriguez,linda.rodriguez19@hotmail.com,456-57-5365,172.28.24.244,F,1972-10-10,90205,126000,76,0.06,85166,True,,,3.4,45000.0,,,389,Female,1972-10-10,126000.0,76,0.06,85166,False,False,False,False,False,False
app_009,"[{'category': 'Entertainment', 'amount': 718}]",,Heather Smith,heather.smith97@gmail.com,476-51-2722,192.168.237.76,Female,1989-11-20,90261,92000,15,0.08,39921,True,,,5.9,27000.0,,,390,Female,1989-11-20,92000.0,15,0.08,39921,False,False,False,False,False,False
app_470,"[{'category': 'Groceries', 'amount': 867}, {'category': 'Healthcare', 'amount': 170}]",,Kenneth Wright,kenneth.wright74@hotmail.com,588-85-4126,172.17.153.140,Male,1984-04-01,10062,66000,40,0.43,32402,True,,,3.4,35000.0,,,391,Male,1984-04-01,66000.0,40,0.43,32402,False,False,False,False,False,False
app_095,"[{'category': 'Rent', 'amount': 804}]",,Jack Sanchez,jack.sanchez68@aol.com,130-62-7748,192.168.112.200,M,1986-05-12,10049,116000,58,0.39,53274,True,,,5.0,51000.0,,,392,Male,1986-05-12,116000.0,58,0.39,53274,False,False,False,False,False,False
app_055,"[{'category': 'Groceries', 'amount': 254}, {'category': 'Utilities', 'amount': 851}, {'category': 'Travel', 'amount': 188}]",,Scott Lopez,scott.lopez69@gmail.com,495-48-2129,172.28.222.9,Male,1978-11-11,10009,104000,51,0.16,52179,True,,,4.3,51000.0,,,393,Male,1978-11-11,104000.0,51,0.16,52179,False,False,False,False,False,False
app_428,"[{'category': 'Transportation', 'amount': 68}]",,Jerry Wilson,jerry.wilson60@icloud.com,112-19-6168,192.168.155.6,M,1963-08-02,10053,103000,78,0.19,29305,True,,,4.0,74000.0,,,394,Male,1963-08-02,103000.0,78,0.19,29305,False,False,False,False,False,False
app_366,"[{'category': 'Dining', 'amount': 194}, {'category': 'Healthcare', 'amount': 51}, {'category': 'Utilities', 'amount': 396}]",,Catherine Campbell,catherine.campbell57@hotmail.com,352-74-1939,192.168.20.35,Female,1990-11-30,90211,45000,47,0.34,19272,False,algorithm_risk_score,,,,,,395,Female,1990-11-30,45000.0,47,0.34,19272,False,False,False,False,False,False
app_187,"[{'category': 'Fitness', 'amount': 428}]",2024-01-15T00:00:00Z,Andrew Lewis,andrew.lewis53@aol.com,875-49-5940,192.168.117.114,M,1990-06-27,10085,67000,52,0.3,31102,False,algorithm_risk_score,,,,,,396,Male,1990-06-27,67000.0,52,0.3,31102,False,False,False,False,False,False
app_188,"[{'category': 'Utilities', 'amount': 269}, {'category': 'Entertainment', 'amount': 449}]",2024-01-15T00:00:00Z,Elizabeth Jackson,elizabeth.jackson75@gmail.com,884-36-9087,172.22.91.113,Female,1987-04-03,90263,98000,64,0.17,45696,True,,,2.7,27000.0,,,397,Female,1987-04-03,98000.0,64,0.17,45696,False,False,False,False,False,False
app_129,"[{'category': 'Entertainment', 'amount': 334}]",,Jessica Jackson,jessica.jackson10@mail.com,734-50-1889,10.220.105.242,Female,1985-05-18,10059,108000,54,0.17,30185,True,,,2.8,30000.0,,,398,Female,1985-05-18,108000.0,54,0.17,30185,False,False,False,False,False,False
app_091,"[{'category': 'Healthcare', 'amount': 542}]",,Gregory Martin,gregory.martin98@protonmail.com,647-30-3311,10.64.161.126,Male,04/11/1988,90218,95000,36,0.12,33444,True,,,4.9,45000.0,,,399,Male,1988-11-04,95000.0,36,0.12,33444,False,False,True,False,False,False
app_319,"[{'category': 'Education', 'amount': 568}]",,Barbara Green,barbara.green70@aol.com,439-47-7955,172.22.198.197,F,1995-08-01,90211,55000,33,0.26,12428,False,insufficient_credit_history,,,,,,400,Female,1995-08-01,55000.0,33,0.26,12428,False,False,False,False,False,False
app_488,"[{'category': 'Entertainment', 'amount': 635}, {'category': 'Education', 'amount': 849}]",,Rachel Moore,rachel.moore12@yahoo.com,366-85-5787,172.28.143.21,Female,1999-12-14,90201,33000,0,0.2,7021,False,algorithm_risk_score,,,,,,401,Female,1999-12-14,33000.0,0,0.2,7021,False,False,False,False,False,False
app_295,"[{'category': 'Entertainment', 'amount': 674}, {'category': 'Alcohol', 'amount': 706}]",,George Lopez,george.lopez85@protonmail.com,312-66-6584,172.22.114.118,Male,1988-02-20,10070,98000,56,0.3,47469,True,,,6.5,18000.0,,,402,Male,1988-02-20,98000.0,56,0.3,47469,False,False,False,False,False,False
app_256,"[{'category': 'Travel', 'amount': 79}, {'category': 'Utilities', 'amount': 178}]",,William Wright,william.wright77@icloud.com,617-29-5383,192.168.243.142,Male,03/05/1995,10051,55000,18,0.23,13079,True,,,3.7,69000.0,,,403,Male,1995-05-03,55000.0,18,0.23,13079,False,False,True,False,False,False
app_221,"[{'category': 'Entertainment', 'amount': 158}]",,Amy Robinson,amy.robinson52@aol.com,607-39-7447,192.168.84.247,Female,2000-04-21,90247,59000,34,0.45,17248,False,insufficient_credit_history,medical,,,,,404,Female,2000-04-21,59000.0,34,0.45,17248,False,False,False,False,False,False
app_139,"[{'category': 'Travel', 'amount': 617}]",,George Garcia,george.garcia25@yahoo.com,864-96-8449,10.184.140.226,Male,1972-12-13,10006,88000,76,0.06,25968,False,algorithm_risk_score,,,,,,405,Male,1972-12-13,88000.0,76,0.06,25968,False,False,False,False,False,False
app_038,"[{'category': 'Healthcare', 'amount': 201}]",,Patrick Nguyen,patrick.nguyen53@gmail.com,596-76-2147,192.168.233.224,Male,1979-04-06,10012,125000,27,0.14,19147,True,,,5.5,35000.0,,,406,Male,1979-04-06,125000.0,27,0.14,19147,False,False,False,False,False,False
app_495,"[{'category': 'Fitness', 'amount': 441}]",,Cynthia Baker,cynthia.baker91@gmail.com,197-64-9441,172.22.234.154,Female,1963-05-16,10069,71000,80,0.34,24928,True,,,4.8,68000.0,,,407,Female,1963-05-16,71000.0,80,0.34,24928,False,False,False,False,False,False
app_480,"[{'category': 'Insurance', 'amount': 171}]",,Gregory Davis,gregory.davis23@icloud.com,854-74-6180,192.168.243.203,Male,1969-11-01,10001,104000,70,0.19,25163,True,,,3.9,68000.0,,,408,Male,1969-11-01,104000.0,70,0.19,25163,False,False,False,False,False,False
app_202,"[{'category': 'Healthcare', 'amount': 73}, {'category': 'Rent', 'amount': 263}, {'category': 'Entertainment', 'amount': 512}]",,Mark Taylor,mark.taylor69@mail.com,948-21-4380,192.168.237.127,M,1996-02-24,10097,62000,29,0.11,14258,True,,auto,5.8,64000.0,,,409,Male,1996-02-24,62000.0,29,0.11,14258,False,False,False,False,False,False
app_209,"[{'category': 'Healthcare', 'amount': 608}, {'category': 'Rent', 'amount': 798}]",,Charles Jackson,charles.jackson70@gmail.com,725-13-6067,10.88.153.43,Male,1988/03/16,10010,106000,51,0.15,51382,True,,moving,5.2,59000.0,,,410,Male,1988-03-16,106000.0,51,0.15,51382,False,False,True,False,False,False
app_426,"[{'category': 'Transportation', 'amount': 369}]",,Dorothy Perez,dorothy.perez96@outlook.com,402-41-6717,10.3.22.225,Female,11/03/1970,90255,78000,105,0.09,49213,True,,,2.8,20000.0,,,411,Female,1970-03-11,78000.0,105,0.09,49213,False,False,True,False,False,False
app_203,"[{'category': 'Insurance', 'amount': 645}]",,Joseph Allen,joseph.allen79@gmail.com,234-34-4011,172.22.253.28,Male,1993-10-29,10093,58000,47,0.44,21458,True,,moving,3.0,51000.0,,,412,Male,1993-10-29,58000.0,47,0.44,21458,False,False,False,False,False,False
app_147,"[{'category': 'Rent', 'amount': 817}, {'category': 'Healthcare', 'amount': 126}, {'category': 'Fitness', 'amount': 836}]",2024-01-15T00:00:00Z,John Harris,john.harris87@hotmail.com,194-73-2525,10.177.132.73,M,1978-08-16,10092,79000,67,0.43,41974,True,,,4.9,65000.0,,,413,Male,1978-08-16,79000.0,67,0.43,41974,False,False,False,False,False,False
app_069,"[{'category': 'Entertainment', 'amount': 540}]",,Stephanie Allen,stephanie.allen32@mail.com,916-13-8007,192.168.98.191,Female,1961-04-14,90237,98000,93,0.25,11645,False,algorithm_risk_score,,,,,,414,Female,1961-04-14,98000.0,93,0.25,11645,False,False,False,False,False,False
app_395,"[{'category': 'Education', 'amount': 818}]",,Sandra Roberts,sandra.roberts28@yahoo.com,697-34-2116,192.168.183.213,Female,1985-09-26,90226,151000,3,0.08,72478,True,,,4.2,46000.0,,,415,Female,1985-09-26,151000.0,3,0.08,72478,False,False,False,False,False,False
app_123,"[{'category': 'Groceries', 'amount': 779}]",,Helen Martinez,helen.martinez39@gmail.com,933-63-8809,10.153.125.202,F,1971/03/31,90272,87000,82,0.23,39088,False,algorithm_risk_score,,,,,,416,Female,1971-03-31,87000.0,82,0.23,39088,False,False,True,False,False,False
app_087,"[{'category': 'Entertainment', 'amount': 726}, {'category': 'Insurance', 'amount': 54}]",,Catherine Campbell,catherine.campbell75@yahoo.com,499-29-5726,10.200.71.18,Female,1987-01-16,90247,94000,53,0.1,48204,True,,,3.2,35000.0,,,417,Female,1987-01-16,94000.0,53,0.1,48204,False,False,False,False,False,False
app_487,"[{'category': 'Utilities', 'amount': 738}]",,Alexander Robinson,alexander.robinson55@yahoo.com,430-74-1011,172.16.177.5,Male,1986-10-29,10057,60000,16,0.24,22759,False,algorithm_risk_score,,,,,,418,Male,1986-10-29,60000.0,16,0.24,22759,False,False,False,False,False,False
app_046,"[{'category': 'Transportation', 'amount': 379}, {'category': 'Groceries', 'amount': 156}, {'category': 'Healthcare', 'amount': 585}]",,Sandra Nelson,sandra.nelson20@mail.com,878-19-2678,192.168.226.197,Female,1977-05-13,90231,122000,44,0.29,34688,False,algorithm_risk_score,,,,,,419,Female,1977-05-13,122000.0,44,0.29,34688,False,False,False,False,False,False
app_058,"[{'category': 'Utilities', 'amount': 504}]",,James King,james.king83@icloud.com,449-13-7773,192.168.193.101,Male,03/16/1970,10067,83000,114,0.35,50490,True,,,2.8,61000.0,,,420,Male,1970-03-16,83000.0,114,0.35,50490,False,False,True,False,False,False
app_359,"[{'category': 'Fitness', 'amount': 363}, {'category': 'Travel', 'amount': 543}]",,Stephanie King,stephanie.king52@hotmail.com,887-89-1075,172.21.62.38,F,1997-03-09,90233,65000,43,0.18,13540,False,algorithm_risk_score,,,,,,421,Female,1997-03-09,65000.0,43,0.18,13540,False,False,False,False,False,False
app_344,"[{'category': 'Education', 'amount': 751}]",,Edward Campbell,edward.campbell91@outlook.com,103-37-9074,192.168.44.92,M,2002/01/18,30029,27000,39,0.1,3885,False,low_income,,,,,,422,Male,2002-01-18,27000.0,39,0.1,3885,False,False,True,False,False,False
app_124,"[{'category': 'Transportation', 'amount': 288}]",,Samuel Wright,samuel.wright1@icloud.com,419-22-4481,172.29.74.118,Male,18/01/1991,10025,65000,54,0.18,11237,True,,,4.3,49000.0,,,423,Male,1991-01-18,65000.0,54,0.18,11237,False,False,True,False,False,False
app_277,"[{'category': 'Rent', 'amount': 222}]",,Jessica Nguyen,jessica.nguyen37@icloud.com,420-57-4295,172.19.191.150,Female,22/11/1960,90206,75000,108,0.14,22838,True,,,6.4,23000.0,,,424,Female,1960-11-22,75000.0,108,0.14,22838,False,False,True,False,False,False
app_044,"[{'category': 'Fitness', 'amount': 526}]",,James Brown,james.brown50@mail.com,181-41-8267,192.168.158.107,Male,1992-02-02,10021,73000,50,0.07,19027,False,algorithm_risk_score,,,,,,425,Male,1992-02-02,73000.0,50,0.07,19027,False,False,False,False,False,False
app_190,"[{'category': 'Dining', 'amount': 317}, {'category': 'Shopping', 'amount': 223}, {'category': 'Fitness', 'amount': 849}]",2024-01-15T00:00:00Z,Heather White,heather.white42@icloud.com,217-44-8191,192.168.242.9,Female,1999-10-05,90297,0,0,0.14,19603,False,algorithm_risk_score,,,,,,426,Female,1999-10-05,0.0,0,0.14,19603,False,False,False,False,False,False
app_373,"[{'category': 'Fitness', 'amount': 844}, {'category': 'Healthcare', 'amount': 417}]",,Sharon Ramirez,sharon.ramirez48@outlook.com,620-42-3577,192.168.182.177,Female,1988-07-31,90273,84000,5,0.3,19050,True,,,5.1,37000.0,,,427,Female,1988-07-31,84000.0,5,0.3,19050,False,False,False,False,False,False
app_355,"[{'category': 'Fitness', 'amount': 777}]",,Jack Mitchell,jack.mitchell87@protonmail.com,353-53-1904,172.30.107.103,Male,1974-07-24,90225,100000,73,0.35,42888,True,,,4.6,24000.0,,,428,Male,1974-07-24,100000.0,73,0.35,42888,False,False,False,False,False,False
app_457,"[{'category': 'Rent', 'amount': 526}, {'category': 'Groceries', 'amount': 683}, {'category': 'Gambling', 'amount': 444}]",,Rebecca Roberts,rebecca.roberts71@icloud.com,713-43-5812,10.38.185.33,Female,11/18/1964,90270,126000,95,0.34,55610,True,,,6.2,34000.0,,,429,Female,1964-11-18,126000.0,95,0.34,55610,False,False,True,False,False,False
app_074,"[{'category': 'Rent', 'amount': 517}, {'category': 'Alcohol', 'amount': 194}]",,Paul Flores,paul.flores81@hotmail.com,385-49-5779,192.168.22.86,Male,28/03/1999,10033,39000,82,0.19,12904,False,low_income,,,,,,430,Male,1999-03-28,39000.0,82,0.19,12904,False,False,True,False,False,False
app_312,"[{'category': 'Travel', 'amount': 686}, {'category': 'Utilities', 'amount': 530}]",,Donald Rodriguez,donald.rodriguez39@protonmail.com,125-28-8331,172.17.36.15,Male,1995-03-11,10079,80000,0,0.39,12438,True,,,3.3,23000.0,,,431,Male,1995-03-11,80000.0,0,0.39,12438,False,False,False,False,False,False
app_411,"[{'category': 'Utilities', 'amount': 879}]",,Thomas Gonzalez,thomas.gonzalez89@icloud.com,199-54-1475,172.21.242.114,Male,1994/03/21,10041,64000,26,0.3,0,True,,,5.1,40000.0,,,432,Male,1994-03-21,64000.0,26,0.3,0,False,False,True,False,False,False
app_390,"[{'category': 'Education', 'amount': 122}, {'category': 'Insurance', 'amount': 508}]",,Mary Nelson,mary.nelson83@yahoo.com,548-73-9755,10.72.130.125,Female,1978-07-11,90224,68000,68,0.2,12310,True,,,5.3,63000.0,,,433,Female,1978-07-11,68000.0,68,0.2,12310,False,False,False,False,False,False
app_013,"[{'category': 'Education', 'amount': 335}]",,Heather Davis,heather.davis26@aol.com,941-17-4706,172.21.115.246,Female,1989-08-23,90218,57000,18,0.45,28706,True,,,3.9,70000.0,,,434,Female,1989-08-23,57000.0,18,0.45,28706,False,False,False,False,False,False
app_401,"[{'category': 'Healthcare', 'amount': 355}]",,Daniel Walker,daniel.walker89@gmail.com,751-65-2036,172.27.207.134,Male,06/03/1972,10038,103000,29,0.39,21830,False,high_dti_ratio,,,,,,435,Male,1972-03-06,103000.0,29,0.39,21830,False,False,True,False,False,False
app_313,"[{'category': 'Travel', 'amount': 853}, {'category': 'Transportation', 'amount': 851}]",,Laura Jones,laura.jones25@yahoo.com,473-60-3268,10.199.251.176,F,1991-03-14,90298,112000,15,0.08,39223,True,,,4.6,52000.0,,,436,Female,1991-03-14,112000.0,15,0.08,39223,False,False,False,False,False,False
app_418,"[{'category': 'Entertainment', 'amount': 197}]",,Rachel King,rachel.king69@icloud.com,107-92-5280,192.168.65.23,Female,05/31/1975,90272,112000,82,0.05,70888,True,,,6.2,36000.0,,,437,Female,1975-05-31,112000.0,82,0.05,70888,False,False,True,False,False,False
app_141,"[{'category': 'Groceries', 'amount': 399}]",2024-01-15T00:00:00Z,Ronald Johnson,ronald.johnson14@gmail.com,806-19-9489,192.168.175.83,Male,1982-08-19,10002,125000,39,0.37,72682,True,,,3.2,37000.0,,,438,Male,1982-08-19,125000.0,39,0.37,72682,False,False,False,False,False,False
app_105,"[{'category': 'Entertainment', 'amount': 512}, {'category': 'Travel', 'amount': 568}]",,Laura Green,laura.green44@mail.com,126-24-8122,10.54.152.20,Female,1986-01-28,90243,116000,22,0.2,69276,True,,,3.6,75000.0,,,439,Female,1986-01-28,116000.0,22,0.2,69276,False,False,False,False,False,False
app_159,"[{'category': 'Education', 'amount': 578}, {'category': 'Dining', 'amount': 507}]",2024-01-15T00:00:00Z,Daniel Gonzalez,daniel.gonzalez84@aol.com,322-72-6023,192.168.123.26,Male,11/10/1960,10084,107000,89,0.22,61596,True,,,6.1,58000.0,,,440,Male,1960-10-11,107000.0,89,0.22,61596,False,False,True,False,False,False
app_051,"[{'category': 'Dining', 'amount': 251}]",2027-01-20T00:00:00Z,Nicholas Thompson,nicholas.thompson68@icloud.com,700-28-7948,172.16.4.236,M,07/15/1999,10060,35000,77,0.2,9646,False,low_income,,,,,,441,Male,1999-07-15,35000.0,77,0.2,9646,False,False,True,False,False,False
app_229,"[{'category': 'Education', 'amount': 686}, {'category': 'Groceries', 'amount': 359}]",,Barbara Campbell,barbara.campbell80@yahoo.com,731-96-9697,172.23.22.89,Female,2000-07-31,90289,39000,41,0.42,18019,True,,wedding,4.1,38000.0,,,442,Female,2000-07-31,39000.0,41,0.42,18019,False,False,False,False,False,False
app_349,"[{'category': 'Fitness', 'amount': 567}, {'category': 'Entertainment', 'amount': 463}]",,Gregory King,gregory.king61@outlook.com,955-57-2824,192.168.140.62,Male,02/23/1989,10087,78000,44,0.34,8641,True,,,6.3,19000.0,,,443,Male,1989-02-23,78000.0,44,0.34,8641,False,False,True,False,False,False
app_025,"[{'category': 'Education', 'amount': 383}]",,Rebecca Walker,rebecca.walker90@aol.com,501-69-2266,192.168.166.120,Female,1965-11-07,90284,72000,63,0.25,33294,False,algorithm_risk_score,,,,,,444,Female,1965-11-07,72000.0,63,0.25,33294,False,False,False,False,False,False
app_456,"[{'category': 'Dining', 'amount': 611}]",,David Jones,david.jones79@yahoo.com,968-66-9483,172.24.150.136,Male,1979-05-02,10070,84000,24,0.34,38163,True,,,6.5,74000.0,,,445,Male,1979-05-02,84000.0,24,0.34,38163,False,False,False,False,False,False
app_111,"[{'category': 'Utilities', 'amount': 447}, {'category': 'Education', 'amount': 644}]",,Raymond Jones,raymond.jones74@icloud.com,191-64-5825,192.168.71.115,M,1999-09-05,10063,42000,55,0.26,9507,True,,,3.2,70000.0,,,446,Male,1999-09-05,42000.0,55,0.26,9507,False,False,False,False,False,False
app_180,"[{'category': 'Entertainment', 'amount': 532}, {'category': 'Dining', 'amount': 75}, {'category': 'Alcohol', 'amount': 614}]",2024-01-15T00:00:00Z,Justin Green,justin.green48@protonmail.com,228-49-1561,10.20.49.18,Male,1969/10/14,10002,111000,52,0.43,30253,False,algorithm_risk_score,,,,,,447,Male,1969-10-14,111000.0,52,0.43,30253,False,False,True,False,False,False
app_350,"[{'category': 'Utilities', 'amount': 876}, {'category': 'Entertainment', 'amount': 670}]",,Linda Adams,,356-98-8263,10.207.183.196,Female,,90291,89000,52,0.2,14377,True,,,4.1,67000.0,,,448,Female,,89000.0,52,0.2,14377,False,False,False,False,False,False
app_061,"[{'category': 'Travel', 'amount': 208}, {'category': 'Shopping', 'amount': 650}]",,Jack Miller,jack.miller8@mail.com,127-48-3577,192.168.189.169,M,20/04/1985,10073,59000,54,0.27,27425,True,,,4.0,28000.0,,,449,Male,1985-04-20,59000.0,54,0.27,27425,False,False,True,False,False,False
app_370,"[{'category': 'Rent', 'amount': 854}, {'category': 'Travel', 'amount': 196}, {'category': 'Insurance', 'amount': 455}]",,Alexander Hernandez,alexander.hernandez88@yahoo.com,113-57-7065,10.196.26.102,M,04/12/1975,10005,126000,41,0.05,60601,True,,,5.9,48000.0,,,450,Male,1975-12-04,126000.0,41,0.05,60601,False,False,True,False,False,False
app_121,"[{'category': 'Shopping', 'amount': 546}, {'category': 'Dining', 'amount': 753}, {'category': 'Insurance', 'amount': 432}]",,Charles Rivera,charles.rivera57@aol.com,481-83-3837,10.184.42.195,Male,05/21/1984,10020,90000,58,0.11,34768,True,,,3.3,66000.0,,,451,Male,1984-05-21,90000.0,58,0.11,34768,False,False,True,False,False,False
app_257,"[{'category': 'Utilities', 'amount': 556}]",,Stephanie Allen,stephanie.allen86@aol.com,509-17-2576,10.114.115.229,Female,08/09/1985,90252,68000,38,0.33,8646,True,,,4.4,58000.0,,,452,Female,1985-09-08,68000.0,38,0.33,8646,False,False,True,False,False,False
app_466,"[{'category': 'Dining', 'amount': 640}]",,Paul Anderson,paul.anderson7@outlook.com,799-49-1206,172.31.5.174,Male,1993/11/17,10055,80000,47,0.4,34196,True,,,4.3,57000.0,,,453,Male,1993-11-17,80000.0,47,0.4,34196,False,False,True,False,False,False
app_388,"[{'category': 'Entertainment', 'amount': 259}]",,Amanda Johnson,amanda.johnson38@protonmail.com,152-84-2809,172.18.118.41,Female,1993-01-03,90296,100000,8,0.22,15898,False,algorithm_risk_score,,,,,,454,Female,1993-01-03,100000.0,8,0.22,15898,False,False,False,False,False,False
app_001,"[{'category': 'Fitness', 'amount': 576}]",,Stephanie Nguyen,stephanie.nguyen47@mail.com,,,,,,102000,37,0.42,0,False,high_dti_ratio,,,,,DUPLICATE_ENTRY_ERROR,455,Unknown,,102000.0,37,0.42,0,True,False,False,False,False,False
app_494,"[{'category': 'Education', 'amount': 668}, {'category': 'Entertainment', 'amount': 825}]",,Robert Mitchell,robert.mitchell50@protonmail.com,444-83-7991,172.18.234.214,M,1999/07/11,10073,32000,0,0.32,9358,False,insufficient_credit_history,,,,,,456,Male,1999-11-07,32000.0,0,0.32,9358,False,False,True,False,False,False
app_210,"[{'category': 'Entertainment', 'amount': 241}]",,Pamela Campbell,pamela.campbell91@outlook.com,719-88-4590,10.113.208.213,Female,1983-06-19,90261,66000,18,0.42,41892,True,,medical,4.8,40000.0,,,457,Female,1983-06-19,66000.0,18,0.42,41892,False,False,False,False,False,False
app_168,"[{'category': 'Groceries', 'amount': 687}, {'category': 'Transportation', 'amount': 354}]",2024-01-15T00:00:00Z,Larry Thompson,larry.thompson20@yahoo.com,674-78-4391,192.168.148.88,M,1997-03-31,10092,71000,29,0.28,22361,True,,,6.1,65000.0,,,458,Male,1997-03-31,71000.0,29,0.28,22361,False,False,False,False,False,False
app_097,"[{'category': 'Fitness', 'amount': 442}, {'category': 'Gambling', 'amount': 216}]",,Emma Roberts,emma.roberts50@gmail.com,817-88-9433,10.9.148.236,Female,1976-11-09,90262,141000,33,0.26,22923,False,insufficient_credit_history,,,,,,459,Female,1976-11-09,141000.0,33,0.26,22923,False,False,False,False,False,False
app_432,"[{'category': 'Rent', 'amount': 453}]",,Amy Nelson,amy.nelson43@icloud.com,109-72-8677,10.141.150.134,Female,2001-10-04,90273,75000,8,0.18,24681,False,algorithm_risk_score,,,,,,460,Female,2001-10-04,75000.0,8,0.18,24681,False,False,False,False,False,False
app_023,"[{'category': 'Fitness', 'amount': 555}, {'category': 'Groceries', 'amount': 661}, {'category': 'Utilities', 'amount': 372}]",,Patrick Flores,patrick.flores43@mail.com,495-77-3208,172.24.122.194,M,1998-07-21,10019,44000,55,0.08,27397,False,algorithm_risk_score,,,,,,461,Male,1998-07-21,44000.0,55,0.08,27397,False,False,False,False,False,False
app_165,"[{'category': 'Dining', 'amount': 435}, {'category': 'Insurance', 'amount': 508}]",2024-01-15T00:00:00Z,Brandon Moore,,,,Male,,10077,66000,6,0.16,36936,True,,,5.6,53000.0,,,462,Male,,66000.0,6,0.16,36936,False,False,False,False,False,False
app_020,"[{'category': 'Fitness', 'amount': 98}]",,Margaret Lee,margaret.lee42@outlook.com,611-64-3809,172.19.238.9,F,1977/12/24,30014,133000,55,0.38,60268,True,,,5.2,23000.0,,,463,Female,1977-12-24,133000.0,55,0.38,60268,False,False,True,False,False,False
app_186,"[{'category': 'Entertainment', 'amount': 850}, {'category': 'Fitness', 'amount': 195}, {'category': 'Travel', 'amount': 698}]",2024-01-15T00:00:00Z,Kenneth Carter,kenneth.carter22@yahoo.com,555-26-1610,172.24.47.150,Male,1986-09-08,10086,115000,41,0.42,39117,True,,,6.0,72000.0,,,464,Male,1986-09-08,115000.0,41,0.42,39117,False,False,False,False,False,False
app_310,"[{'category': 'Utilities', 'amount': 451}, {'category': 'Alcohol', 'amount': 730}]",,Jessica Campbell,jessica.campbell45@protonmail.com,559-35-6495,172.30.195.170,Female,1990-03-06,90284,63000,27,0.37,18949,True,,,5.9,50000.0,,,465,Female,1990-03-06,63000.0,27,0.37,18949,False,False,False,False,False,False
app_342,"[{'category': 'Entertainment', 'amount': 206}]",,Samuel Garcia,samuel.garcia33@aol.com,178-98-4514,172.19.233.85,Male,1983-06-28,10070,45000,17,0.06,622,True,,,3.3,74000.0,,,466,Male,1983-06-28,45000.0,17,0.06,622,False,False,False,False,False,False
app_086,"[{'category': 'Dining', 'amount': 359}, {'category': 'Shopping', 'amount': 574}]",,Ryan Rodriguez,ryan.rodriguez52@yahoo.com,193-76-6702,172.24.172.32,Male,06/05/1993,10030,115000,15,0.17,50342,True,,,2.9,80000.0,,,467,Male,1993-05-06,115000.0,15,0.17,50342,False,False,True,False,False,False
app_286,"[{'category': 'Utilities', 'amount': 349}, {'category': 'Fitness', 'amount': 466}]",,Brian Johnson,brian.johnson29@gmail.com,302-29-8853,192.168.53.101,Male,1993-09-19,10048,85000,0,0.22,17452,True,,,5.4,46000.0,,,468,Male,1993-09-19,85000.0,0,0.22,17452,False,False,False,False,False,False
app_132,"[{'category': 'Fitness', 'amount': 575}, {'category': 'Healthcare', 'amount': 91}]",,Justin Rodriguez,justin.rodriguez96@mail.com,387-16-2383,192.168.209.11,Male,11/26/1975,10040,82000,42,0.39,25146,True,,,5.6,32000.0,,,469,Male,1975-11-26,82000.0,42,0.39,25146,False,False,True,False,False,False
app_296,"[{'category': 'Education', 'amount': 157}]",,Mark Young,mark.young46@outlook.com,601-33-7524,10.10.178.72,Male,1987-07-11,10072,103000,57,0.45,44538,True,,,3.6,76000.0,,,470,Male,1987-07-11,103000.0,57,0.45,44538,False,False,False,False,False,False
app_249,"[{'category': 'Shopping', 'amount': 214}, {'category': 'Insurance', 'amount': 659}]",,Joshua Garcia,joshua.garcia70@icloud.com,121-85-2187,10.40.52.159,Male,1958-11-20,30043,121000,82,0.08,44322,True,,home_improvement,4.7,73000.0,,,471,Male,1958-11-20,121000.0,82,0.08,44322,False,False,False,False,False,False
app_063,"[{'category': 'Shopping', 'amount': 833}, {'category': 'Healthcare', 'amount': 404}]",,Nicole Adams,nicole.adams28@gmail.com,252-62-4568,172.31.2.111,Female,1997-04-03,90243,55000,45,0.1,14715,True,,,4.0,57000.0,,,472,Female,1997-04-03,55000.0,45,0.1,14715,False,False,False,False,False,False
app_314,"[{'category': 'Education', 'amount': 449}, {'category': 'Travel', 'amount': 726}]",,Elizabeth Sanchez,elizabeth.sanchez94@outlook.com,850-13-2311,192.168.165.218,Female,1996-01-03,90266,73000,31,0.3,19081,False,algorithm_risk_score,,,,,,473,Female,1996-01-03,73000.0,31,0.3,19081,False,False,False,False,False,False
app_062,"[{'category': 'Shopping', 'amount': 146}, {'category': 'Entertainment', 'amount': 329}, {'category': 'Groceries', 'amount': 885}]",,Catherine Carter,catherine.carter77@icloud.com,614-69-8974,10.97.126.194,Female,1979-03-13,90275,64000,109,0.39,34015,True,,,3.1,16000.0,,,474,Female,1979-03-13,64000.0,109,0.39,34015,False,False,False,False,False,False
app_137,"[{'category': 'Insurance', 'amount': 717}]",,Amy Garcia,amy.garcia70@outlook.com,929-73-4834,192.168.157.6,Female,1990-04-18,90205,81000,53,0.19,13306,False,algorithm_risk_score,,,,,,475,Female,1990-04-18,81000.0,53,0.19,13306,False,False,False,False,False,False
app_336,"[{'category': 'Healthcare', 'amount': 358}, {'category': 'Travel', 'amount': 885}]",,Brenda Carter,brenda.carter35@mail.com,103-64-7163,172.26.222.199,Female,02/26/1988,90293,116000,39,0.09,27855,False,algorithm_risk_score,,,,,,476,Female,1988-02-26,116000.0,39,0.09,27855,False,False,True,False,False,False
app_322,"[{'category': 'Healthcare', 'amount': 897}]",,Amy Smith,amy.smith50@hotmail.com,208-85-9940,10.236.92.130,F,24/02/1992,90246,84000,0,0.42,12426,False,high_dti_ratio,,,,,,477,Female,1992-02-24,84000.0,0,0.42,12426,False,False,True,False,False,False
app_473,"[{'category': 'Insurance', 'amount': 169}]",,Karen Harris,karen.harris60@protonmail.com,795-85-4042,172.28.33.181,Female,1991-08-26,90244,54000,0,0.21,13722,True,,,4.2,43000.0,,,478,Female,1991-08-26,54000.0,0,0.21,13722,False,False,False,False,False,False
app_122,"[{'category': 'Insurance', 'amount': 685}, {'category': 'Utilities', 'amount': 782}, {'category': 'Travel', 'amount': 888}]",,Richard Thomas,richard.thomas4@hotmail.com,186-34-2952,192.168.201.220,Male,1964-12-12,10057,98000,61,0.26,14834,True,,,5.5,69000.0,,,479,Male,1964-12-12,98000.0,61,0.26,14834,False,False,False,False,False,False
app_222,"[{'category': 'Entertainment', 'amount': 298}, {'category': 'Travel', 'amount': 315}]",,Brenda Perez,brenda.perez96@aol.com,636-56-7305,192.168.133.49,F,1965-11-07,90299,102000,104,0.28,17483,False,algorithm_risk_score,personal,,,,,480,Female,1965-11-07,102000.0,104,0.28,17483,False,False,False,False,False,False
app_481,"[{'category': 'Dining', 'amount': 725}]",,Nicole Nguyen,nicole.nguyen89@outlook.com,891-16-6831,172.18.35.225,Female,27/07/1985,90229,142000,38,0.17,62154,True,,,3.3,56000.0,,,481,Female,1985-07-27,142000.0,38,0.17,62154,False,False,True,False,False,False
app_218,"[{'category': 'Travel', 'amount': 240}]",,Mark Scott,mark.scott72@aol.com,653-15-8386,10.216.243.5,Male,1982-04-09,10083,80000,80,0.43,22276,True,,medical,2.7,29000.0,,,482,Male,1982-04-09,80000.0,80,0.43,22276,False,False,False,False,False,False
app_476,"[{'category': 'Insurance', 'amount': 667}, {'category': 'Rent', 'amount': 279}, {'category': 'Entertainment', 'amount': 187}]",,Gregory Allen,gregory.allen43@yahoo.com,990-83-8035,192.168.239.250,Male,1975-09-01,10082,53000,118,0.44,8148,True,,,3.9,77000.0,,,483,Male,1975-09-01,53000.0,118,0.44,8148,False,False,False,False,False,False
app_191,"[{'category': 'Shopping', 'amount': 303}, {'category': 'Fitness', 'amount': 188}, {'category': 'Entertainment', 'amount': 737}]",2024-01-15T00:00:00Z,Pamela Hill,pamela.hill70@outlook.com,757-87-6454,172.28.37.204,Female,1959-09-06,90281,98000,78,0.16,20428,False,algorithm_risk_score,,,,,,484,Female,1959-09-06,98000.0,78,0.16,20428,False,False,False,False,False,False
app_177,"[{'category': 'Shopping', 'amount': 392}]",2024-01-15T00:00:00Z,Thomas Smith,thomas.smith57@outlook.com,298-38-4813,172.20.125.153,Male,25/01/1990,10004,54000,35,0.05,25705,True,,,5.9,67000.0,,,485,Male,1990-01-25,54000.0,35,0.05,25705,False,False,True,False,False,False
app_453,"[{'category': 'Travel', 'amount': 372}, {'category': 'Groceries', 'amount': 145}]",,Kenneth Torres,kenneth.torres3@protonmail.com,330-78-9036,192.168.178.124,Male,2000/04/13,10030,28000,0,0.22,12529,False,insufficient_credit_history,,,,,,486,Male,2000-04-13,28000.0,0,0.22,12529,False,False,True,False,False,False
app_269,"[{'category': 'Shopping', 'amount': 540}, {'category': 'Rent', 'amount': 619}, {'category': 'Groceries', 'amount': 552}]",,William Hall,william.hall20@aol.com,106-34-1270,10.132.131.45,Male,08/12/1984,10009,152000,44,0.32,88078,False,algorithm_risk_score,,,,,,487,Male,1984-12-08,152000.0,44,0.32,88078,False,False,True,False,False,False
app_273,"[{'category': 'Shopping', 'amount': 604}, {'category': 'Travel', 'amount': 163}]",,Justin Jackson,justin.jackson12@outlook.com,855-33-5461,192.168.235.7,Male,1995-02-22,10033,82000,88,0.26,24454,True,,,4.4,44000.0,,,488,Male,1995-02-22,82000.0,88,0.26,24454,False,False,False,False,False,False
app_472,"[{'category': 'Fitness', 'amount': 798}, {'category': 'Groceries', 'amount': 132}]",,Dennis Lewis,dennis.lewis59@gmail.com,852-99-9160,172.27.4.156,Male,1977-04-09,10080,81000,53,0.44,16798,False,algorithm_risk_score,,,,,,489,Male,1977-04-09,81000.0,53,0.44,16798,False,False,False,False,False,False
app_224,"[{'category': 'Entertainment', 'amount': 131}]",,Mark Jackson,mark.jackson41@yahoo.com,263-68-2220,10.248.103.20,Male,1968-06-04,10052,93000,81,0.12,53299,False,algorithm_risk_score,medical,,,,,490,Male,1968-06-04,93000.0,81,0.12,53299,False,False,False,False,False,False
app_012,"[{'category': 'Rent', 'amount': 567}, {'category': 'Shopping', 'amount': 408}]",,Janet Lopez,janet.lopez72@aol.com,646-74-3314,172.19.203.79,Female,1972-09-26,90220,96000,71,0.22,38284,False,algorithm_risk_score,,,,,,491,Female,1972-09-26,96000.0,71,0.22,38284,False,False,False,False,False,False
app_437,"[{'category': 'Dining', 'amount': 825}]",,Ashley Lopez,ashley.lopez68@icloud.com,637-73-3119,192.168.220.15,Female,01/02/1992,10033,107000,59,0.33,33144,True,,,5.6,69000.0,,,492,Female,1992-02-01,107000.0,59,0.33,33144,False,False,True,False,False,False
app_305,"[{'category': 'Education', 'amount': 629}, {'category': 'Insurance', 'amount': 619}]",,Mark Hernandez,mark.hernandez8@hotmail.com,460-68-4910,192.168.94.129,M,1984-04-09,10084,100000,30,0.07,44145,True,,,5.6,49000.0,,,493,Male,1984-04-09,100000.0,30,0.07,44145,False,False,False,False,False,False
app_266,"[{'category': 'Insurance', 'amount': 126}, {'category': 'Utilities', 'amount': 373}, {'category': 'Healthcare', 'amount': 86}]",,Betty Jones,betty.jones46@protonmail.com,155-87-5931,192.168.5.251,Female,04/03/1995,90202,46000,16,0.13,20079,False,insufficient_credit_history,,,,,,494,Female,1995-03-04,46000.0,16,0.13,20079,False,False,True,False,False,False
app_324,"[{'category': 'Entertainment', 'amount': 453}]",,Donna Smith,donna.smith10@aol.com,610-14-8613,192.168.170.94,Female,30/05/1982,90250,96000,89,0.16,25814,False,algorithm_risk_score,,,,,,495,Female,1982-05-30,96000.0,89,0.16,25814,False,False,True,False,False,False
app_049,"[{'category': 'Fitness', 'amount': 444}, {'category': 'Entertainment', 'amount': 848}, {'category': 'Groceries', 'amount': 131}]",,Donna Gonzalez,donna.gonzalez12@yahoo.com,845-50-3562,192.168.14.85,F,2000/05/22,90278,59000,92,0.36,31881,False,algorithm_risk_score,,,,,,496,Female,2000-05-22,59000.0,92,0.36,31881,False,False,True,False,False,False
app_468,"[{'category': 'Transportation', 'amount': 701}]",,Patrick Martinez,patrick.martinez26@aol.com,996-86-6099,172.31.95.30,Male,1999-05-23,10046,22000,35,0.35,8982,False,insufficient_credit_history,,,,,,497,Male,1999-05-23,22000.0,35,0.35,8982,False,False,False,False,False,False
app_192,"[{'category': 'Healthcare', 'amount': 650}]",2024-01-15T00:00:00Z,Dennis Lopez,dennis.lopez78@yahoo.com,936-44-8002,172.29.183.18,Male,11/15/1985,10088,78000,40,0.22,34292,True,,,6.0,18000.0,,,498,Male,1985-11-15,78000.0,40,0.22,34292,False,False,True,False,False,False
app_234,"[{'category': 'Insurance', 'amount': 526}]",,Samuel Hill,samuel.hill67@protonmail.com,937-72-8731,10.143.146.157,Male,1976/01/29,10090,96000,60,0.3,38703,False,algorithm_risk_score,education,,,,,499,Male,1976-01-29,96000.0,60,0.3,38703,False,False,True,False,False,False
app_306,"[{'category': 'Insurance', 'amount': 490}]",,Anna White,anna.white6@gmail.com,757-27-8131,10.26.176.56,Female,1978-07-26,90227,106000,80,0.29,63560,True,,,3.1,57000.0,,,500,Female,1978-07-26,106000.0,80,0.29,63560,False,False,False,False,False,False
app_163,"[{'category': 'Shopping', 'amount': 404}]",2024-01-15T00:00:00Z,Edward White,edward.white48@gmail.com,324-94-2806,172.26.137.15,Male,03/06/1981,10019,104000,58,0.3,38425,True,,,2.9,47000.0,,,501,Male,1981-06-03,104000.0,58,0.3,38425,False,False,True,False,False,False
